,Title,Year,Source title,Authors,Volume,Art. No.,DOI,Link,Document Type,Publication Stage
EC2,Survivable and bandwidth-guaranteed embedding of virtual clusters in cloud data centers,2017,Proceedings - IEEE INFOCOM,"Yu, R., Xue, G., Zhang, X., Li, D.",,8056945,10.1109/INFOCOM.2017.8056945,https://www.scopus.com/inward/record.uri?eid=2-s2.0-85034041000&doi=10.1109%2fINFOCOM.2017.8056945&partnerID=40&md5=b417e52198d5246dbe54bb4cbad8eeda,Conference Paper,Final
EC4,A Collaborative DDoS Defence Framework Using Network Function Virtualization,2017,IEEE Transactions on Information Forensics and Security,"Rashidi, B., Fung, C., Bertino, E.",12,7934441,10.1109/TIFS.2017.2708693,https://www.scopus.com/inward/record.uri?eid=2-s2.0-85029210559&doi=10.1109%2fTIFS.2017.2708693&partnerID=40&md5=5e44fc22671442e353405fe549f46cc8,Article,Final
EC4,Feedback for increased robustness of forwarding graphs in the cloud,2017,Journal of Systems Architecture,"Millnert, V., Eker, J., Bini, E.",80,,10.1016/j.sysarc.2017.09.005,https://www.scopus.com/inward/record.uri?eid=2-s2.0-85030834824&doi=10.1016%2fj.sysarc.2017.09.005&partnerID=40&md5=c577285572a42f4b3f2ddad06a7f4f7c,Article,Final
EC2,Online Learning-Assisted VNF Service Chain Scaling with Network Uncertainties,2017,"IEEE International Conference on Cloud Computing, CLOUD","Wang, X., Wu, C., Le, F., Lau, F.C.M.",2017-June,8030590,10.1109/CLOUD.2017.34,https://www.scopus.com/inward/record.uri?eid=2-s2.0-85032230557&doi=10.1109%2fCLOUD.2017.34&partnerID=40&md5=a104fb7285dbf162b21704859a842894,Conference Paper,Final
EC4,An SDN Based Framework for Guaranteeing Security and Performance in Information-Centric Cloud Networks,2017,"IEEE International Conference on Cloud Computing, CLOUD","Ghosh, U., Chatterjee, P., Tosh, D., Shetty, S., Xiong, K., Kamhoua, C.",2017-June,8030664,10.1109/CLOUD.2017.106,https://www.scopus.com/inward/record.uri?eid=2-s2.0-85032183066&doi=10.1109%2fCLOUD.2017.106&partnerID=40&md5=b9e07583a8a4055dd28a97a49a54ca44,Conference Paper,Final
EC2,Dynamic role assignment in Software-Defined Wireless Networks,2017,Proceedings - IEEE Symposium on Computers and Communications,"Graubner, P., Sommer, M., Hollick, M., Freisleben, B.",,8024619,10.1109/ISCC.2017.8024619,https://www.scopus.com/inward/record.uri?eid=2-s2.0-85030569329&doi=10.1109%2fISCC.2017.8024619&partnerID=40&md5=87b53eb569f51960b13c76673833a856,Conference Paper,Final
EC2,On Dynamic service function chain deployment and readjustment,2017,IEEE Transactions on Network and Service Management,"Liu, J., Lu, W., Zhou, F., Lu, P., Zhu, Z.",14,7938396,10.1109/TNSM.2017.2711610,https://www.scopus.com/inward/record.uri?eid=2-s2.0-85028930403&doi=10.1109%2fTNSM.2017.2711610&partnerID=40&md5=4038ee32a096d49608a1956a4597f4b8,Article,Final
EC4,A programmable Controller for unified management of virtualized network infrastructures,2017,Proceedings - IEEE Symposium on Computers and Communications,"Yassin, M., Guillouard, K., Ouzzif, M., Picard, R., Aluze, D.",,8024711,10.1109/ISCC.2017.8024711,https://www.scopus.com/inward/record.uri?eid=2-s2.0-85030551954&doi=10.1109%2fISCC.2017.8024711&partnerID=40&md5=ed1e26333b4b881af2eeb39fe0c267c0,Conference Paper,Final
EC4,Brokered orchestration for end-to-end service provisioning across heterogeneous multi-operator networks,2017,International Conference on Transparent Optical Networks,"Velasco, L., Gifre, L., Castro, A.",,8025183,10.1109/ICTON.2017.8025183,https://www.scopus.com/inward/record.uri?eid=2-s2.0-85031008677&doi=10.1109%2fICTON.2017.8025183&partnerID=40&md5=92c4755eac4a541348e980a35a1885ba,Conference Paper,Final
EC2,A comprehensive resource management and placement for network function virtualization,2017,"2017 IEEE Conference on Network Softwarization: Softwarization Sustaining a Hyper-Connected World: en Route to 5G, NetSoft 2017","Nguyen, T.-M., Fdida, S., Pham, T.-M.",,8004197,10.1109/NETSOFT.2017.8004197,https://www.scopus.com/inward/record.uri?eid=2-s2.0-85029378528&doi=10.1109%2fNETSOFT.2017.8004197&partnerID=40&md5=43cc5380f002daa391779c098bea7d70,Conference Paper,Final
EC5,A chaotic grey wolf controller allocator for Software Defined Mobile Network (SDMN) for 5th generation of cloud-based cellular systems (5G),2017,Computer Communications,"Farshin, A., Sharifian, S.",108,,10.1016/j.comcom.2017.05.003,https://www.scopus.com/inward/record.uri?eid=2-s2.0-85019977803&doi=10.1016%2fj.comcom.2017.05.003&partnerID=40&md5=20ab989118f2991edc5114309640c6cb,Article,Final
EC2,Redundant placement of virtualized network functions for LTE evolved Multimedia Broadcast Multicast Services,2017,IEEE International Conference on Communications,"Chantre, H.D., Da Fonseca, N.L.S.",,7996870,10.1109/ICC.2017.7996870,https://www.scopus.com/inward/record.uri?eid=2-s2.0-85028330476&doi=10.1109%2fICC.2017.7996870&partnerID=40&md5=9776c1f60df6d78be1cf95fc8c7c3089,Conference Paper,Final
EC2,Virtual network embedding with pre-transformation and incentive convergence mechanism,2017,Concurrency Computation,"Wang, C., Liu, G., Peng, S., Yuan, Y., Li, G., Wan, C.",29,e3947,10.1002/cpe.3947,https://www.scopus.com/inward/record.uri?eid=2-s2.0-84983528074&doi=10.1002%2fcpe.3947&partnerID=40&md5=a5bc72743bae169d5234d6b056fceb56,Conference Paper,Final
EC2,A distributed NFV orchestrator based on BDI reasoning,2017,Proceedings of the IM 2017 - 2017 IFIP/IEEE International Symposium on Integrated Network and Service Management,"Schardong, F., Nunes, I., Schaeffer-Filho, A.",,7987270,10.23919/INM.2017.7987270,https://www.scopus.com/inward/record.uri?eid=2-s2.0-85029427393&doi=10.23919%2fINM.2017.7987270&partnerID=40&md5=c31aaaaeb40bd32f051e05fac62db4ad,Conference Paper,Final
EC4,NFV service dynamicity with a DevOps approach: Insights from a use-case realization,2017,Proceedings of the IM 2017 - 2017 IFIP/IEEE International Symposium on Integrated Network and Service Management,"Van Rossem, S., Cai, X., Cerrato, I., Danielsson, P., Németh, F., Pechenot, B., Pelle, I., Risso, F., Sharma, S., Sköldström, P., John, W.",,7987357,10.23919/INM.2017.7987357,https://www.scopus.com/inward/record.uri?eid=2-s2.0-85029434688&doi=10.23919%2fINM.2017.7987357&partnerID=40&md5=b105d3155c9f944e0f5ade22ff2fcc22,Conference Paper,Final
EC3,Resource pooling via dynamic spectrum-level slicing across heterogeneous networks,2017,"2017 14th IEEE Annual Consumer Communications and Networking Conference, CCNC 2017","Gebremariam, A.A., Chowdhury, M., Goldsmith, A., Granelli, F.",,7983239,10.1109/CCNC.2017.7983239,https://www.scopus.com/inward/record.uri?eid=2-s2.0-85027417662&doi=10.1109%2fCCNC.2017.7983239&partnerID=40&md5=4d4e7df2fce7fc310f4d7ec64568f4a1,Conference Paper,Final
OK,Virtualized Network Coding Functions on the Internet,2017,Proceedings - International Conference on Distributed Computing Systems,"Zhang, L., Lai, S., Wu, C., Li, Z., Guo, C.",,7979961,10.1109/ICDCS.2017.95,https://www.scopus.com/inward/record.uri?eid=2-s2.0-85027245275&doi=10.1109%2fICDCS.2017.95&partnerID=40&md5=c44e9dc4ca5a39e7c127156a5760a2e2,Conference Paper,Final
OK,An Efficient Algorithm for Virtual Network Function Scaling,2017,"2017 IEEE Global Communications Conference, GLOBECOM 2017 - Proceedings","Houidi, O., Soualah, O., Louati, W., Mechtri, M., Zeghlache, D., Kamoun, F.",2018-January,,10.1109/GLOCOM.2017.8254727,https://www.scopus.com/inward/record.uri?eid=2-s2.0-85046468138&doi=10.1109%2fGLOCOM.2017.8254727&partnerID=40&md5=7a6f7ebccbec236805b10f0c18fb9f04,Conference Paper,Final
EC2,Cost-Efficient Virtual Network Function Graph (vNFG) Provisioning in Multidomain Elastic Optical Networks,2017,Journal of Lightwave Technology,"Wang, Y., Lu, P., Lu, W., Zhu, Z.",35,7915681,10.1109/JLT.2017.2700229,https://www.scopus.com/inward/record.uri?eid=2-s2.0-85028729534&doi=10.1109%2fJLT.2017.2700229&partnerID=40&md5=43b6109aea8219e8a37628190bc42c09,Article,Final
EC3,Towards Dynamic Bandwidth Management Optimization in VSDN Networks,2017,"2017 IEEE Global Communications Conference, GLOBECOM 2017 - Proceedings","Chai, Y., Shou, G., Liu, Y., Hu, Y., Guo, Z.",2018-January,,10.1109/GLOCOM.2017.8254750,https://www.scopus.com/inward/record.uri?eid=2-s2.0-85046469128&doi=10.1109%2fGLOCOM.2017.8254750&partnerID=40&md5=c812d1b9928534bc79b55050b7c4a0c2,Conference Paper,Final
OK,Dynamic resource allocation based on Q-learning for VNE in Fiber-wireless (FiWi) access network,2017,ACM International Conference Proceeding Series,"Ou, Q.H., Zhao, H., Ye, Y., Yu, X., Liu, Z., Liao, X., Liu, L.",Part F130281,,10.1145/3121360.3121381,https://www.scopus.com/inward/record.uri?eid=2-s2.0-85030155042&doi=10.1145%2f3121360.3121381&partnerID=40&md5=fe1a4df00c4a42fe70de5b976b800573,Conference Paper,Final
EC6,"Proceedings - European Workshop on Software-Defined Networks, EWSDN",2017,"Proceedings - European Workshop on Software-Defined Networks, EWSDN",[No author name available],2016-October,,,https://www.scopus.com/inward/record.uri?eid=2-s2.0-85054291273&partnerID=40&md5=f5096aa64e5dce86674645cbbb9886ab,Conference Review,Final
EC4,Design and implementation of a network function framework for performance scalability,2017,"2017 9th International Conference on Communication Systems and Networks, COMSNETS 2017","Woo, S.",,7945457,10.1109/COMSNETS.2017.7945457,https://www.scopus.com/inward/record.uri?eid=2-s2.0-85021966222&doi=10.1109%2fCOMSNETS.2017.7945457&partnerID=40&md5=cf066d5847d2cfbcaa89759967606f8d,Conference Paper,Final
EC2,Network function placement on virtualized cellular cores,2017,"2017 9th International Conference on Communication Systems and Networks, COMSNETS 2017","Dietrich, D., Papagianni, C., Papadimitriou, P., Baras, J.S.",,7945385,10.1109/COMSNETS.2017.7945385,https://www.scopus.com/inward/record.uri?eid=2-s2.0-85021877949&doi=10.1109%2fCOMSNETS.2017.7945385&partnerID=40&md5=c0484c3448ed4c54b87c156462b45be4,Conference Paper,Final
EC5,End-to-end service orchestration from access to backbone,2017,Journal of Optical Communications and Networking,"Lopez, V., Gran Josa, J.M., Uceda, V., Slyne, F., Ruffini, M., Vilalta, R., Mayoral, A., Muñoz, R., Casellas, R., Martínez, R.",9,7947083,10.1364/JOCN.9.00B137,https://www.scopus.com/inward/record.uri?eid=2-s2.0-85028369104&doi=10.1364%2fJOCN.9.00B137&partnerID=40&md5=a98ef66e6f3fbf0cfb82b1a4f76b286a,Article,Final
EC2,Energy-Aware Mapping and Live Migration of Virtual Networks,2017,IEEE Systems Journal,"Rodriguez, E., Alkmim, G.P., Da Fonseca, N.L.S., Batista, D.M.",11,,10.1109/JSYST.2015.2467159,https://www.scopus.com/inward/record.uri?eid=2-s2.0-85027434767&doi=10.1109%2fJSYST.2015.2467159&partnerID=40&md5=878f7b5b5f9a97541666f36e85fa8c57,Article,Final
EC4,"End-to-end programmable, cloud-based virtualized HetNet: Advances made &amp; challenges to address",2017,Computer Communications,"Moshiur Rahman, M., Despins, C., Affes, S.",105,,10.1016/j.comcom.2017.01.012,https://www.scopus.com/inward/record.uri?eid=2-s2.0-85028281446&doi=10.1016%2fj.comcom.2017.01.012&partnerID=40&md5=f3184d467cbd748face2f5d6f910d8a3,Review,Final
EC2,Resilient virtual network mapping against large-scale regional failures,2017,"2017 26th Wireless and Optical Communication Conference, WOCC 2017","Galdamez, C., Ye, Z.",,7928978,10.1109/WOCC.2017.7928978,https://www.scopus.com/inward/record.uri?eid=2-s2.0-85021391743&doi=10.1109%2fWOCC.2017.7928978&partnerID=40&md5=c8116fab160756209b01cd14c9c3c466,Conference Paper,Final
EC2,Robust embedding of VNF/service chains with delay bounds,2017,"2016 IEEE Conference on Network Function Virtualization and Software Defined Networks, NFV-SDN 2016","Reddy, V.S., Baumgartner, A., Bauschert, T.",,7919482,10.1109/NFV-SDN.2016.7919482,https://www.scopus.com/inward/record.uri?eid=2-s2.0-85020051430&doi=10.1109%2fNFV-SDN.2016.7919482&partnerID=40&md5=9bc05407b9f29a543ae4d2cef3f56fcc,Conference Paper,Final
EC4,Benefits of conditional FPGA provisioning for virtualized network functions,2017,"2017 International Conference on Networked Systems, NetSys 2017","Nobach, L., Rudolph, B., Hausheer, D.",,7903967,10.1109/NetSys.2017.7903967,https://www.scopus.com/inward/record.uri?eid=2-s2.0-85019237434&doi=10.1109%2fNetSys.2017.7903967&partnerID=40&md5=42d845274bb83ab7842cc632c9643da1,Conference Paper,Final
EC2,Method for resource allocation of virtualized network functions in hybrid environment,2017,"2016 IEEE International Black Sea Conference on Communications and Networking, BlackSeaCom 2016","Larysa, G., Mariia, S., Svitlana, S.",,7901546,10.1109/BlackSeaCom.2016.7901546,https://www.scopus.com/inward/record.uri?eid=2-s2.0-85007377772&doi=10.1109%2fBlackSeaCom.2016.7901546&partnerID=40&md5=155e13fcc15499ccbbda952d0475e204,Conference Paper,Final
EC5,Forecasting and anticipating SLO breaches in programmable networks,2017,"Proceedings of the 2017 20th Conference on Innovations in Clouds, Internet and Networks, ICIN 2017","Bendriss, J., Ben Yahia, I.G., Zeghlache, D.",,7899402,10.1109/ICIN.2017.7899402,https://www.scopus.com/inward/record.uri?eid=2-s2.0-85018935966&doi=10.1109%2fICIN.2017.7899402&partnerID=40&md5=dc903ca139f9299f06e5df1df06208b2,Conference Paper,Final
EC2,Optimizing resource allocation for elastic security VNFs in the SDNFV-enabled cloud computing,2017,International Conference on Information Networking,"Phan, T.V., Bao, N.K., Kim, Y., Lee, H.-J., Park, M.",,7899497,10.1109/ICOIN.2017.7899497,https://www.scopus.com/inward/record.uri?eid=2-s2.0-85018239377&doi=10.1109%2fICOIN.2017.7899497&partnerID=40&md5=9e8d1b902e69a090058c8922b472a2c9,Conference Paper,Final
EC4,An SDN/NFV-Enabled Enterprise Network Architecture Offering Fine-Grained Security Policy Enforcement,2017,IEEE Communications Magazine,"Lorenz, C., Hock, D., Scherer, J., Durner, R., Kellerer, W., Gebert, S., Gray, N., Zinner, T., Tran-Gia, P.",55,7828267,10.1109/MCOM.2017.1600414CM,https://www.scopus.com/inward/record.uri?eid=2-s2.0-85010222439&doi=10.1109%2fMCOM.2017.1600414CM&partnerID=40&md5=f49b779433e996e9b5654d35ce9a20d3,Article,Final
EC2,Online VNF scaling in datacenters,2017,"IEEE International Conference on Cloud Computing, CLOUD","Wang, X., Wu, C., Le, F., Liu, A., Li, Z., Lau, F.",,7820265,10.1109/CLOUD.2016.26,https://www.scopus.com/inward/record.uri?eid=2-s2.0-85014164039&doi=10.1109%2fCLOUD.2016.26&partnerID=40&md5=d9d8d959e12112a445f02d11e84df892,Conference Paper,Final
EC4,A test design method for resilient system on cloud infrastructure,2017,"IEEE International Conference on Cloud Computing, CLOUD","Fujiwaka, M., Machida, F., Koizumi, S.",,7820302,10.1109/CLOUD.2016.63,https://www.scopus.com/inward/record.uri?eid=2-s2.0-85014201170&doi=10.1109%2fCLOUD.2016.63&partnerID=40&md5=4c41f8929aeef3c04d346cf709aeee09,Conference Paper,Final
EC4,Optimal construction of virtual networks for Cloud-based MapReduce workflows,2017,Computer Networks,"Xu, C., Yang, J., Yin, K., Yu, H.",112,,10.1016/j.comnet.2016.11.001,https://www.scopus.com/inward/record.uri?eid=2-s2.0-84996671103&doi=10.1016%2fj.comnet.2016.11.001&partnerID=40&md5=2f3b206fe49733b551d07fe2106df81f,Article,Final
EC4,Cloud-based platforms and infrastructures: Provisioning physical and virtual networks,2017,Advancing Cloud Database Systems and Capacity Planning With Dynamic Applications,"Tanque, M.",,,10.4018/978-1-5225-2013-9.ch003,https://www.scopus.com/inward/record.uri?eid=2-s2.0-85016640432&doi=10.4018%2f978-1-5225-2013-9.ch003&partnerID=40&md5=1d65e69653c4ee101c3c3fcdfc696ea0,Book Chapter,Final
EC2,Virtual resources allocation scheme in ICT converged networks,2017,Lecture Notes in Electrical Engineering,"Kim, H.",424,,10.1007/978-981-10-4154-9_87,https://www.scopus.com/inward/record.uri?eid=2-s2.0-85016089935&doi=10.1007%2f978-981-10-4154-9_87&partnerID=40&md5=c961afb715cf06e1ede751c38fd42460,Conference Paper,Final
EC2,Need for a transport aPI in 5G for global orchestration of cloud and networks through a virtualized infrastructure manager and planner [invited],2017,Journal of Optical Communications and Networking,"Mayoral, A., Muñoz, R., Vilalta, R., Casellas, R., Martínez, R., López, V.",9,7830262,10.1364/JOCN.9.000A55,https://www.scopus.com/inward/record.uri?eid=2-s2.0-85011333611&doi=10.1364%2fJOCN.9.000A55&partnerID=40&md5=683e89cca7afcdb9563b99add51475e9,Article,Final
EC5,Redefining communication with 5G mobile technology,2017,"Mobile Networks: Concepts, Applications and Performance Analysis","Kao, L.-C.",,,,https://www.scopus.com/inward/record.uri?eid=2-s2.0-85034413507&partnerID=40&md5=10727f0bda9fc5071a1bebc3caa587c1,Book Chapter,Final
EC5,Enabling highly dynamic mobile scenarios with software defined networking,2017,IEEE Communications Magazine,"Celdran, A.H., Perez, M.G., Clemente, F.J.G., Perez, G.M.",55,7901485,10.1109/MCOM.2017.1600117CM,https://www.scopus.com/inward/record.uri?eid=2-s2.0-85018947125&doi=10.1109%2fMCOM.2017.1600117CM&partnerID=40&md5=59697f92139c16da3f4140e3689408ab,Article,Final
EC4,Host-based virtual networks management in cloud datacenters,2017,Computing and Informatics,"Kontoudis, D., Fouliras, P.",36,,10.4149/cai_2017_3_541,https://www.scopus.com/inward/record.uri?eid=2-s2.0-85029358986&doi=10.4149%2fcai_2017_3_541&partnerID=40&md5=f2cbc1f29ded3e81c7027109317e9337,Article,Final
EC5,Resource management techniques in licensed shared access networks,2017,"Networks of the Future: Architectures, Technologies, and Implementations","Butt, M.M., McMenamy, J., Farhang, A., Macaluso, I., Galiotto, C., Marchetti, N.",,,10.1201/b21234,https://www.scopus.com/inward/record.uri?eid=2-s2.0-85052672538&doi=10.1201%2fb21234&partnerID=40&md5=272bc7bf90440b8c38b32f9d4b09d8f5,Book Chapter,Final
EC3,Towards efficient server architecture for virtualized network function deployment: Implications and implementations,2016,"Proceedings of the Annual International Symposium on Microarchitecture, MICRO","Hu, Y., Li, T.",2016-December,7783711,10.1109/MICRO.2016.7783711,https://www.scopus.com/inward/record.uri?eid=2-s2.0-85006743530&doi=10.1109%2fMICRO.2016.7783711&partnerID=40&md5=e168a0554fd1efed19c73b99ada4175d,Conference Paper,Final
EC6,"2016 1st IEEE International Conference on Computer Communication and the Internet, ICCCI 2016",2016,"2016 1st IEEE International Conference on Computer Communication and the Internet, ICCCI 2016",[No author name available],,,,https://www.scopus.com/inward/record.uri?eid=2-s2.0-85010289638&partnerID=40&md5=14f1e99e3a72bb8209865c75ed2879f3,Conference Review,Final
EC6,"Proceedings - 2016 5th IEEE International Conference on Cloud Networking, CloudNet 2016",2016,"Proceedings - 2016 5th IEEE International Conference on Cloud Networking, CloudNet 2016",[No author name available],,,,https://www.scopus.com/inward/record.uri?eid=2-s2.0-85010641870&partnerID=40&md5=864105e9d52477f6e032a527d775c23b,Conference Review,Final
OK,Seamless Support of Low Latency Mobile Applications with NFV-Enabled Mobile Edge-Cloud,2016,"Proceedings - 2016 5th IEEE International Conference on Cloud Networking, CloudNet 2016","Yang, B., Chai, W.K., Pavlou, G., Katsaros, K.V.",,7776589,10.1109/CloudNet.2016.21,https://www.scopus.com/inward/record.uri?eid=2-s2.0-85010685422&doi=10.1109%2fCloudNet.2016.21&partnerID=40&md5=fc8d1c0e614543d42b2fa4773f51d8d8,Conference Paper,Final
EC4,Virtual Resource Allocation in Software-Defined Information-Centric Cellular Networks with Device-to-Device Communications and Imperfect CSI,2016,IEEE Transactions on Vehicular Technology,"Wang, K., Li, H., Yu, F.R., Wei, W.",65,7406764,10.1109/TVT.2016.2529660,https://www.scopus.com/inward/record.uri?eid=2-s2.0-85012996396&doi=10.1109%2fTVT.2016.2529660&partnerID=40&md5=651cab1e38ac4b6252ab198b7d3e064e,Article,Final
EC5,Enhanced auction-assisted LSA,2016,Proceedings of the International Symposium on Wireless Communication Systems,"McMenamy, J., Farhang, A., Marchetti, N., Macaluso, I.",2016-October,7600959,10.1109/ISWCS.2016.7600959,https://www.scopus.com/inward/record.uri?eid=2-s2.0-84994383108&doi=10.1109%2fISWCS.2016.7600959&partnerID=40&md5=dbfcb278674dd9a7981083a709f01036,Conference Paper,Final
EC3,Delay-Aware Scheduling and Resource Optimization with Network Function Virtualization,2016,IEEE Transactions on Communications,"Qu, L., Assi, C., Shaban, K.",64,7490404,10.1109/TCOMM.2016.2580150,https://www.scopus.com/inward/record.uri?eid=2-s2.0-84988640924&doi=10.1109%2fTCOMM.2016.2580150&partnerID=40&md5=d171e300292ffa1a628f4dab6667237d,Conference Paper,Final
EC3,Experimental demonstration of bandwidth on demand (BoD) provisioning based on time scheduling in software-defined multi-domain optical networks,2016,Optical Fiber Technology,"Zhao, Y., Li, Y., Wang, X., Chen, B., Zhang, J.",31,,10.1016/j.yofte.2016.07.001,https://www.scopus.com/inward/record.uri?eid=2-s2.0-84978410993&doi=10.1016%2fj.yofte.2016.07.001&partnerID=40&md5=0a00056d3746864aaa5fa233ec8a8e2f,Article,Final
EC4,U-HAUL: Efficient state migration in NFV,2016,"Proceedings of the 7th ACM SIGOPS Asia-Pacific Workshop on Systems, APSys 2016","Liu, L., Xu, H., Niu, Z., Wang, P., Han, D.",,2967363,10.1145/2967360.2967363,https://www.scopus.com/inward/record.uri?eid=2-s2.0-84986582633&doi=10.1145%2f2967360.2967363&partnerID=40&md5=4ef1d280532ed6f7717f0fa1442cb48a,Conference Paper,Final
OK,A new resource management algorithm of a virtual internet architecture,2016,"Proceedings of the 28th Chinese Control and Decision Conference, CCDC 2016","Wei, Y., Wang, J.",,7531386,10.1109/CCDC.2016.7531386,https://www.scopus.com/inward/record.uri?eid=2-s2.0-84983787890&doi=10.1109%2fCCDC.2016.7531386&partnerID=40&md5=6dd121e7db5579ab9bbef9107e362ecd,Conference Paper,Final
EC2,Virtual edge architecture with optical bandwidth resource control,2016,IEICE Transactions on Communications,"Misawa, A., Mochizuki, K., Tsuchiya, H., Nakagawa, M., Hattori, K., Katayama, M., Kani, J.-I.",E99B,,10.1587/transcom.2015CCT0001,https://www.scopus.com/inward/record.uri?eid=2-s2.0-84980347805&doi=10.1587%2ftranscom.2015CCT0001&partnerID=40&md5=de210ea7649ff80f70f21934f6427d1e,Conference Paper,Final
EC2,Orchestrating tree-type VNF forwarding graphs in inter-DC elastic optical networks,2016,Journal of Lightwave Technology,"Zeng, M., Fang, W., Zhu, Z.",34,7466778,10.1109/JLT.2016.2565002,https://www.scopus.com/inward/record.uri?eid=2-s2.0-84980037510&doi=10.1109%2fJLT.2016.2565002&partnerID=40&md5=72d6fd9389a9a1ce8ab27c9fa241c669,Article,Final
EC2,Orchestrating multicast-oriented NFV trees in inter-DC elastic optical networks,2016,"2016 IEEE International Conference on Communications, ICC 2016","Zeng, M., Fang, W., Rodrigues, J.J.P.C., Zhu, Z.",,7511588,10.1109/ICC.2016.7511588,https://www.scopus.com/inward/record.uri?eid=2-s2.0-84981350570&doi=10.1109%2fICC.2016.7511588&partnerID=40&md5=e8265271fbb901dcb56a329d6e198909,Conference Paper,Final
EC4,A capacity broker architecture and framework for multi-tenant support in LTE-A networks,2016,"2016 IEEE International Conference on Communications, ICC 2016","Tseliou, G., Samdanis, K., Adelantado, F., Perez, X.C., Verikoukis, C.",,7511042,10.1109/ICC.2016.7511042,https://www.scopus.com/inward/record.uri?eid=2-s2.0-84981294945&doi=10.1109%2fICC.2016.7511042&partnerID=40&md5=5aee7ea0ca8e16b98ff1d1f29bb9ce36,Conference Paper,Final
EC4,A dynamic pricing algorithm for a network of virtual resources,2016,"IEEE NETSOFT 2016 - 2016 IEEE NetSoft Conference and Workshops: Software-Defined Infrastructure for Networks, Clouds, IoT and Services","Naudts, B., Flores, M., Mijumbi, R., Verbrugge, S., Serrat, J., Colle, D.",,7502429,10.1109/NETSOFT.2016.7502429,https://www.scopus.com/inward/record.uri?eid=2-s2.0-84980038944&doi=10.1109%2fNETSOFT.2016.7502429&partnerID=40&md5=f42f032ea4f9bfbc20a3b5801c670571,Conference Paper,Final
EC4,Dynamic load management for IMS networks using network function virtualization,2016,Proceedings of the NOMS 2016 - 2016 IEEE/IFIP Network Operations and Management Symposium,"Dandin, K., Hokelek, I., Kurt, G.K.",,7502948,10.1109/NOMS.2016.7502948,https://www.scopus.com/inward/record.uri?eid=2-s2.0-84979781069&doi=10.1109%2fNOMS.2016.7502948&partnerID=40&md5=b1830450e6164ce2d4069f081cf4faef,Conference Paper,Final
EC6,Proceedings of the NOMS 2016 - 2016 IEEE/IFIP Network Operations and Management Symposium,2016,Proceedings of the NOMS 2016 - 2016 IEEE/IFIP Network Operations and Management Symposium,[No author name available],,,,https://www.scopus.com/inward/record.uri?eid=2-s2.0-84979782479&partnerID=40&md5=bf3d952fedcc2aa5f208d862808e9e7b,Conference Review,Final
OK,A self-stabilizing framework for dynamic bandwidth allocation in virtual networks,2016,Proceedings of the NOMS 2016 - 2016 IEEE/IFIP Network Operations and Management Symposium,"Jmila, H., Drira, K., Zeghlache, D.",,7502798,10.1109/NOMS.2016.7502798,https://www.scopus.com/inward/record.uri?eid=2-s2.0-84979732924&doi=10.1109%2fNOMS.2016.7502798&partnerID=40&md5=5eb31cb73444eebd40e54a901e4c2547,Conference Paper,Final
EC6,"2016 20th International Conference on Optical Network Design and Modeling, ONDM 2016",2016,"2016 20th International Conference on Optical Network Design and Modeling, ONDM 2016",[No author name available],,,,https://www.scopus.com/inward/record.uri?eid=2-s2.0-84978496358&partnerID=40&md5=7b46435ba62d45121f7b1d17932fb7df,Conference Review,Final
EC4,Performance evaluation of multi-stratum resources optimization with network functions virtualization for cloud-based radio over optical fiber networks,2016,Optics Express,"Yang, H., He, Y., Zhang, J., Ji, Y., Bai, W., Lee, Y.",24,259494,10.1364/OE.24.008666,https://www.scopus.com/inward/record.uri?eid=2-s2.0-84964626360&doi=10.1364%2fOE.24.008666&partnerID=40&md5=0eebd14599d61a776336e7c862bd76ab,Article,Final
