,Title,Year,Source title,Authors,Volume,Art. No.,DOI,Link,Document Type,Publication Stage
OK,Autonomic resource arbitration and service-continuable network function migration along service function chains,2018,"IEEE/IFIP Network Operations and Management Symposium: Cognitive Management in a Cyber World, NOMS 2018","Miyazawa, T., Jibiki, M., Kafle, V.P., Harai, H.",,,10.1109/NOMS.2018.8406235,https://www.scopus.com/inward/record.uri?eid=2-s2.0-85050701859&doi=10.1109%2fNOMS.2018.8406235&partnerID=40&md5=dceca47a17515ba4f22ff7085d896dea,Conference Paper,Final
OK,Filtering observations to improve resource control in virtual computer and network systems,2018,"IEEE/IFIP Network Operations and Management Symposium: Cognitive Management in a Cyber World, NOMS 2018","Martinez-Julia, P., Kafle, V.P., Harai, H.",,,10.1109/NOMS.2018.8406176,https://www.scopus.com/inward/record.uri?eid=2-s2.0-85050664280&doi=10.1109%2fNOMS.2018.8406176&partnerID=40&md5=2480d8f0db1adc7d91fead8442937017,Conference Paper,Final
EC3,Joint Optimization of VNF Deployment and Routing in Software Defined Satellite Networks,2018,IEEE Vehicular Technology Conference,"Jia, Z., Sheng, M., Li, J., Liu, R., Guo, K., Wang, Y., Chen, D., DIng, R.",2018-August,8690972,10.1109/VTCFall.2018.8690972,https://www.scopus.com/inward/record.uri?eid=2-s2.0-85064951899&doi=10.1109%2fVTCFall.2018.8690972&partnerID=40&md5=ca0813d40a4019917c033c14e2160f62,Conference Paper,Final
EC5,DeepSDN: Connecting the Dots Towards Self-driving Networks,2018,"2018 IEEE 37th International Performance Computing and Communications Conference, IPCCC 2018","Atwal, K.S., Bassiouni, M.",,8711025,10.1109/PCCC.2018.8711025,https://www.scopus.com/inward/record.uri?eid=2-s2.0-85066505955&doi=10.1109%2fPCCC.2018.8711025&partnerID=40&md5=d66cbb0a66d92e6d9fbe8728b3656632,Conference Paper,Final
OK,Dynamic Reservation and Deep Reinforcement Learning based Autonomous Resource Management for wireless Virtual Networks,2018,"2018 IEEE 37th International Performance Computing and Communications Conference, IPCCC 2018","Sun, G., Zemuy, G.T., Xiong, K.",,8710960,10.1109/PCCC.2018.8710960,https://www.scopus.com/inward/record.uri?eid=2-s2.0-85066482795&doi=10.1109%2fPCCC.2018.8710960&partnerID=40&md5=36644916269dedc331df745d78bf42e4,Conference Paper,Final
EC4,Learning-based dynamic scalable load-balanced firewall as a service in network function-virtualized cloud computing environments,2018,Journal of Supercomputing,"Dezhabad, N., Sharifian, S.",74,,10.1007/s11227-018-2387-5,https://www.scopus.com/inward/record.uri?eid=2-s2.0-85045843063&doi=10.1007%2fs11227-018-2387-5&partnerID=40&md5=4cc3ae1d825b3b0b8240071e7a90169e,Article,Final
EC4,Multi-layer Virtual Transport Network Design,2018,Journal of Network and Systems Management,"Wang, Y., Matta, I.",26,,10.1007/s10922-017-9442-z,https://www.scopus.com/inward/record.uri?eid=2-s2.0-85033453319&doi=10.1007%2fs10922-017-9442-z&partnerID=40&md5=5288f5f661de1d937fabd011c1e4fcab,Article,Final
EC2,Efficient Embedding of Virtual Networks to Distributed Clouds via Exploring Periodic Resource Demands,2018,IEEE Transactions on Cloud Computing,"Xu, Z., Liang, W., Xia, Q.",6,7420672,10.1109/TCC.2016.2535215,https://www.scopus.com/inward/record.uri?eid=2-s2.0-85052988015&doi=10.1109%2fTCC.2016.2535215&partnerID=40&md5=5ffa7dbc011c27060c6507f8048863c5,Article,Final
EC3,Resource Scheduling Mechanism for Virtual Network Slice Based on Online Double Auction,2018,Dianzi Yu Xinxi Xuebao/Journal of Electronics and Information Technology,"Chen, Q., Shi, Y., Yang, X., Tang, L.",40,,10.11999/JEIT170902,https://www.scopus.com/inward/record.uri?eid=2-s2.0-85054869058&doi=10.11999%2fJEIT170902&partnerID=40&md5=6ca1ef772ef2dc13b87c49554d8f37b8,Article,Final
OK,Joint Spectrum Reservation and On-Demand Request for Mobile Virtual Network Operators,2018,IEEE Transactions on Communications,"Zhang, Y., Bi, S., Zhang, Y.-J.A.",66,,10.1109/TCOMM.2018.2809724,https://www.scopus.com/inward/record.uri?eid=2-s2.0-85042716336&doi=10.1109%2fTCOMM.2018.2809724&partnerID=40&md5=c08313c843c7d152d02143060f458993,Article,Final
EC2,A scalable resource allocation scheme for NFV: Balancing utilization and path stretch,2018,"21st Conference on Innovation in Clouds, Internet and Networks, ICIN 2018","Woldeyohannes, Y.T., Mohammadkhan, A., Ramakrishnan, K.K., Jiang, Y.",,,10.1109/ICIN.2018.8401631,https://www.scopus.com/inward/record.uri?eid=2-s2.0-85050209103&doi=10.1109%2fICIN.2018.8401631&partnerID=40&md5=16449f793c0b6b2b7ddcb649853c955d,Conference Paper,Final
EC4,Self provisioning framework for virtualized network functions,2018,"21st Conference on Innovation in Clouds, Internet and Networks, ICIN 2018","Mechteri, M., Ben Yahia, I.G.",,,10.1109/ICIN.2018.8401598,https://www.scopus.com/inward/record.uri?eid=2-s2.0-85050202376&doi=10.1109%2fICIN.2018.8401598&partnerID=40&md5=ef23cbaa884b8b906f4b0df67ae234e1,Conference Paper,Final
EC6,"22nd Conference on Optical Network Design and Modelling, ONDM 2018 - Proceedings",2018,"22nd Conference on Optical Network Design and Modelling, ONDM 2018 - Proceedings",[No author name available],,,,https://www.scopus.com/inward/record.uri?eid=2-s2.0-85050275279&partnerID=40&md5=74aa70cf3be59a4234d58cb51d323a27,Conference Review,Final
EC2,Context-aware service function chaining and its cost-effective orchestration in multi-domain networks,2018,IEEE Access,"Li, G., Zhou, H., Feng, B., Li, G.",6,,10.1109/ACCESS.2018.2848266,https://www.scopus.com/inward/record.uri?eid=2-s2.0-85048628831&doi=10.1109%2fACCESS.2018.2848266&partnerID=40&md5=c203e5789dbded63dbf136af8a273701,Article,Final
EC4,Automated profiling of virtualized media processing functions using telemetry and machine learning,2018,"Proceedings of the 9th ACM Multimedia Systems Conference, MMSys 2018","Mekuria, R., McGrath, M.J., Riccobene, V., Bayon-Molino, V., Tselios, C., Thomson, J., Dobrodub, A.",,,10.1145/3204949.3204976,https://www.scopus.com/inward/record.uri?eid=2-s2.0-85050683060&doi=10.1145%2f3204949.3204976&partnerID=40&md5=341977503db129ad014ff0263eee211d,Conference Paper,Final
EC2,Canonical domains for optimal network slice planning,2018,"IEEE Wireless Communications and Networking Conference, WCNC","Laghrissi, A., Taleb, T., Bagaa, M.",2018-April,,10.1109/WCNC.2018.8377336,https://www.scopus.com/inward/record.uri?eid=2-s2.0-85047888463&doi=10.1109%2fWCNC.2018.8377336&partnerID=40&md5=3912e7d4b8df9b907170e3345cdedceb,Conference Paper,Final
EC2,An approach for virtual network function deployment based on pooling in vEPC,2018,IEICE Transactions on Communications,"Yuan, Q., Tang, H., Zhao, Y., Wang, X.",E101B,,10.1587/transcom.2017EBP3211,https://www.scopus.com/inward/record.uri?eid=2-s2.0-85048568825&doi=10.1587%2ftranscom.2017EBP3211&partnerID=40&md5=fcadca916447901935c85602e827e84a,Article,Final
EC5,Optimization of the implementation of network slicing in 5G RAN,2018,"2018 IEEE Middle East and North Africa Communications Conference, MENACOMM 2018","Salhab, N., Falou, S.E., Rahim, R., Ayoubi, S.E.E., Langar, R.",,,10.1109/MENACOMM.2018.8371035,https://www.scopus.com/inward/record.uri?eid=2-s2.0-85049163322&doi=10.1109%2fMENACOMM.2018.8371035&partnerID=40&md5=92d14ea1be47c1fb35758efaa1e999d6,Conference Paper,Final
EC2,Elastic Vehicular Resource Providing Based on Service Function-Group Resource Mapping of Smart Identify Network,2018,IEEE Systems Journal,"Wang, J., Qi, Q., Qing, S., Liao, J.",12,,10.1109/JSYST.2017.2771443,https://www.scopus.com/inward/record.uri?eid=2-s2.0-85038868334&doi=10.1109%2fJSYST.2017.2771443&partnerID=40&md5=4b70b7f5f161c417c1c2f2fa67c55483,Article,Final
EC2,Drawing the Cloud Map: Virtual Network Provisioning in Distributed Cloud Computing Data Centers,2018,IEEE Systems Journal,"Alhazmi, K., Sharkh, M.A., Shami, A.",12,,10.1109/JSYST.2015.2484298,https://www.scopus.com/inward/record.uri?eid=2-s2.0-84961317660&doi=10.1109%2fJSYST.2015.2484298&partnerID=40&md5=758191c53d12a8296cc55692f31d73d2,Article,Final
EC5,"Routing, modulation level, spectrum and transceiver assignment in elastic optical networks",2018,IEICE Transactions on Communications,"Yang, M., Guo, K., Zhang, Y., Ji, Y.",E101B,,10.1587/transcom.2017EBP3309,https://www.scopus.com/inward/record.uri?eid=2-s2.0-85046343305&doi=10.1587%2ftranscom.2017EBP3309&partnerID=40&md5=3256364bc7497ae52171239238655512,Article,Final
EC4,A two-level auction for resource allocation in multi-tenant C-RAN,2018,Computer Networks,"Morcos, M., Chahed, T., Chen, L., Elias, J., Martignon, F.",135,,10.1016/j.comnet.2018.02.005,https://www.scopus.com/inward/record.uri?eid=2-s2.0-85042698950&doi=10.1016%2fj.comnet.2018.02.005&partnerID=40&md5=bc8a998e22ba71138584155c0fa808fb,Article,Final
EC2,Column generation algorithms for virtual network embedding in flexi-grid optical networks,2018,Optics Express,"Lin, R., Luo, S., Zhou, J., Wang, S., Chen, B., Zhang, X., Cai, A., Zhong, W.-D., Zukerman, M.",26,,10.1364/OE.26.010898,https://www.scopus.com/inward/record.uri?eid=2-s2.0-85045580125&doi=10.1364%2fOE.26.010898&partnerID=40&md5=14989a82cfe92c2763f8d423c39bbc76,Article,Final
EC3,Delay-Aware Resource Scheduling Optimization in Network Function Virtualization ,2018,Jisuanji Yanjiu yu Fazhan/Computer Research and Development,"Xu, R., Wang, W., Gong, X., Que, X.",55,,10.7544/issn1000-1239.2018.20170926,https://www.scopus.com/inward/record.uri?eid=2-s2.0-85053334393&doi=10.7544%2fissn1000-1239.2018.20170926&partnerID=40&md5=6de9845d538f66e513b41a7490b8d1d0,Article,Final
EC2,"VSPACE: VNF Simultaneous Placement, Admission Control and Embedding",2018,IEEE Journal on Selected Areas in Communications,"Nejad, M.A.T., Parsaeefard, S., Maddah-Ali, M.A., Mahmoodi, T., Khalaj, B.H.",36,,10.1109/JSAC.2018.2815318,https://www.scopus.com/inward/record.uri?eid=2-s2.0-85043466329&doi=10.1109%2fJSAC.2018.2815318&partnerID=40&md5=da6eddf6d06a309f32c04c4244af9543,Article,Final
EC4,Cost-Efficient NFV-Enabled Mobile Edge-Cloud for Low Latency Mobile Applications,2018,IEEE Transactions on Network and Service Management,"Yang, B., Chai, W.K., Xu, Z., Katsaros, K.V., Pavlou, G.",15,,10.1109/TNSM.2018.2790081,https://www.scopus.com/inward/record.uri?eid=2-s2.0-85040554325&doi=10.1109%2fTNSM.2018.2790081&partnerID=40&md5=374d121c305ce087aa7959db8808777c,Article,Final
EC2,Conformal Mapping for Optimal Network Slice Planning Based on Canonical Domains,2018,IEEE Journal on Selected Areas in Communications,"Laghrissi, A., Taleb, T., Bagaa, M.",36,,10.1109/JSAC.2018.2815436,https://www.scopus.com/inward/record.uri?eid=2-s2.0-85043462259&doi=10.1109%2fJSAC.2018.2815436&partnerID=40&md5=3e2d3e67934ede676b4074c23377c5a9,Conference Paper,Final
EC5,Resource management architecture of metro aggregation network for IoT traffic,2018,IEICE Transactions on Communications,"Misawa, A., Katayama, M.",E101B,,10.1587/transcom.2017NRI0002,https://www.scopus.com/inward/record.uri?eid=2-s2.0-85042665253&doi=10.1587%2ftranscom.2017NRI0002&partnerID=40&md5=1800e3b3968bb28948ab99e2a9ebeb88,Article,Final
EC5,"On active, fine-grained RAN and spectrum sharing in multi-tenant 5G networks",2018,"IEEE International Symposium on Personal, Indoor and Mobile Radio Communications, PIMRC","Khan, S.N., Goratti, L., Riggio, R., Hasan, S.",2017-October,,10.1109/PIMRC.2017.8292672,https://www.scopus.com/inward/record.uri?eid=2-s2.0-85045278118&doi=10.1109%2fPIMRC.2017.8292672&partnerID=40&md5=c40f920912dff0bf1f59c92016865518,Conference Paper,Final
EC4,Leveraging mixed-strategy gaming to realize incentive-driven VNF service chain provisioning in broker-based elastic optical inter-datacenter networks,2018,Journal of Optical Communications and Networking,"Chen, X., Zhu, Z., Guo, J., Kang, S., Proietti, R., Castro, A., Yoo, S.J.B.",10,,10.1364/JOCN.10.00A232,https://www.scopus.com/inward/record.uri?eid=2-s2.0-85042636456&doi=10.1364%2fJOCN.10.00A232&partnerID=40&md5=c8c031e01f49918ad4cfecd27bdb1908,Article,Final
EC2,Revised virtual resources allocation scheme in network function virtualization (NFV) enabled networks,2018,Lecture Notes in Electrical Engineering,"Kim, H.",425,,10.1007/978-981-10-5281-1_45,https://www.scopus.com/inward/record.uri?eid=2-s2.0-85022231454&doi=10.1007%2f978-981-10-5281-1_45&partnerID=40&md5=71224372ae9d58771d5b8f4bfb61ec35,Conference Paper,Final
OK,Elastic Network Service Chain with Fine-Grained Vertical Scaling,2018,"2018 IEEE Global Communications Conference, GLOBECOM 2018 - Proceedings","Yu, H., Yang, J., Fung, C.",,8648096,10.1109/GLOCOM.2018.8648096,https://www.scopus.com/inward/record.uri?eid=2-s2.0-85063508787&doi=10.1109%2fGLOCOM.2018.8648096&partnerID=40&md5=8d2a8683779fe227f68aaab3939ef289,Conference Paper,Final
EC5,"Software-defined multi-cloud computing: A vision, architectural elements, and future directions",2018,Lecture Notes in Computer Science (including subseries Lecture Notes in Artificial Intelligence and Lecture Notes in Bioinformatics),"Buyya, R., Son, J.",10960 LNCS,,10.1007/978-3-319-95162-1_1,https://www.scopus.com/inward/record.uri?eid=2-s2.0-85049913113&doi=10.1007%2f978-3-319-95162-1_1&partnerID=40&md5=f29b90f48199858df6464eabd01279ad,Conference Paper,Final
OK,A Queuing Based Dynamic Auto Scaling Algorithm for the LTE EPC Control Plane,2018,"2018 IEEE Global Communications Conference, GLOBECOM 2018 - Proceedings","Prados-Garzon, J., Laghrissi, A., Bagaa, M., Taleb, T.",,8648023,10.1109/GLOCOM.2018.8648023,https://www.scopus.com/inward/record.uri?eid=2-s2.0-85061678634&doi=10.1109%2fGLOCOM.2018.8648023&partnerID=40&md5=f1eda88988cc37741a151195fe91fa34,Conference Paper,Final
EC2,Survivable multipath virtual network embedding against multiple failures for SDN/NFV,2018,IEEE Access,"Yin, S., Huang, S., Liu, H., Guo, B., Gao, T., Li, W.",6,8543228,10.1109/ACCESS.2018.2882793,https://www.scopus.com/inward/record.uri?eid=2-s2.0-85057146558&doi=10.1109%2fACCESS.2018.2882793&partnerID=40&md5=076ae00bf3a73d55827e6226fd2905f1,Article,Final
EC4,New kid on the block: Network functions virtualization: From big boxes to carrier clouds,2018,Computer Communication Review,"Nobach, L., Hohlfeld, O., Hausheer, D.",46,7,10.1145/3243157.3243164,https://www.scopus.com/inward/record.uri?eid=2-s2.0-85064542919&doi=10.1145%2f3243157.3243164&partnerID=40&md5=4e4232eed5e5a84917d57670628c607b,Review,Final
OK,A method for adaptive resource adjustment of dynamic service function chain,2018,IEEE Access,"Liu, Y., Zhang, H., Guan, H., Wang, Y.",6,8529195,10.1109/ACCESS.2018.2880251,https://www.scopus.com/inward/record.uri?eid=2-s2.0-85056510708&doi=10.1109%2fACCESS.2018.2880251&partnerID=40&md5=90fb5f8d45c751043c70fcc949b002c3,Article,Final
EC6,"1st International Conference on 5G for Future Wireless Networks, 5GWN 2017",2018,"Lecture Notes of the Institute for Computer Sciences, Social-Informatics and Telecommunications Engineering, LNICST",[No author name available],211,,,https://www.scopus.com/inward/record.uri?eid=2-s2.0-85040240954&partnerID=40&md5=4fc7693180fdd8d1176909896525cfc0,Conference Review,Final
OK,Smart Scaling of the 5G Core Network: An RNN-Based Approach,2018,"2018 IEEE Global Communications Conference, GLOBECOM 2018 - Proceedings","Alawe, I., Hadjadj-Aoul, Y., Ksentini, A., Bertin, P., Viho, C., Darche, D.",,8647590,10.1109/GLOCOM.2018.8647590,https://www.scopus.com/inward/record.uri?eid=2-s2.0-85063436065&doi=10.1109%2fGLOCOM.2018.8647590&partnerID=40&md5=ec8dfd0d1eeb219448e9afff867626d6,Conference Paper,Final
EC2,Energy-saved virtual network embedding based on weighted simplified swarm optimization,2018,Journal of Advanced Oxidation Technologies,"Zheng, X., Su, Y., Yang, L.",21,201804691,10.26802/jaots.2018.04691,https://www.scopus.com/inward/record.uri?eid=2-s2.0-85051347771&doi=10.26802%2fjaots.2018.04691&partnerID=40&md5=1f01512fbe37c8fb0f73fc1f5c2f998f,Article,Final
EC2,A biological model for resource allocation and user dynamics in virtualized hetnet,2018,Wireless Communications and Mobile Computing,"Ma, L., Wen, X., Wang, L., Lu, Z., Knopp, R., Ghauri, I.",2018,1745904,10.1155/2018/1745904,https://www.scopus.com/inward/record.uri?eid=2-s2.0-85056541725&doi=10.1155%2f2018%2f1745904&partnerID=40&md5=c6b761ed7e876cb6ebf164bdfc61481c,Article,Final
OK,StarCube: An On-Demand and Cost-Effective Framework for Cloud Data Center Networks with Performance Guarantee,2018,IEEE Transactions on Cloud Computing,"Tsai, L., Liao, W.",6,,10.1109/TCC.2015.2464818,https://www.scopus.com/inward/record.uri?eid=2-s2.0-85043278486&doi=10.1109%2fTCC.2015.2464818&partnerID=40&md5=debea315713ddbca350bbb8ed983583a,Article,Final
EC5,SLA-Aware Fine-Grained QoS Provisioning for Multi-Tenant Software-Defined Networks,2018,IEEE Access,"Li, G., Wu, J., Li, J., Zhou, Z., Guo, L.",6,8068930,10.1109/ACCESS.2017.2761553,https://www.scopus.com/inward/record.uri?eid=2-s2.0-85041769391&doi=10.1109%2fACCESS.2017.2761553&partnerID=40&md5=98b324c7ee946d316792b8ce7c86838e,Article,Final
EC2,Location Aware and Node Ranking Value-Assisted Embedding Algorithm for One-Stage Embedding in Multiple Distributed Virtual Network Embedding,2018,IEEE Access,"Cao, H., Guo, Y., Hu, Y., Wu, S., Zhu, H., Yang, L.",6,8558489,10.1109/ACCESS.2018.2885033,https://www.scopus.com/inward/record.uri?eid=2-s2.0-85058135971&doi=10.1109%2fACCESS.2018.2885033&partnerID=40&md5=e49327fa0239271fac01feab4ce97fec,Article,Final
EC6,Proceedings of SPIE - The International Society for Optical Engineering,2018,Proceedings of SPIE - The International Society for Optical Engineering,[No author name available],10617,,,https://www.scopus.com/inward/record.uri?eid=2-s2.0-85041116497&partnerID=40&md5=4b4780ed20a95e75801edebda097bc1a,Conference Review,Final
EC5,On Fast Slice Reconfiguration,2018,"2018 IEEE Global Communications Conference, GLOBECOM 2018 - Proceedings","Wang, G., Feng, G., Quek, T.Q.S., Qin, S.",,8648117,10.1109/GLOCOM.2018.8648117,https://www.scopus.com/inward/record.uri?eid=2-s2.0-85063521730&doi=10.1109%2fGLOCOM.2018.8648117&partnerID=40&md5=c3a0dffaecc4cae6cca473f0e44dbac3,Conference Paper,Final
EC5,Fog computing: Enabling the management and orchestration of smart city applications in 5G networks,2018,Entropy,"Santos, J., Wauters, T., Volckaert, B., de Turck, F.",20,4,10.3390/e20010004,https://www.scopus.com/inward/record.uri?eid=2-s2.0-85040629702&doi=10.3390%2fe20010004&partnerID=40&md5=2011a3c768e17ad0a71e0ffb4a695d2a,Article,Final
EC6,"Proceedings of the International Conference on Cloud Computing Technology and Science, CloudCom",2017,"Proceedings of the International Conference on Cloud Computing Technology and Science, CloudCom",[No author name available],2017-December,,,https://www.scopus.com/inward/record.uri?eid=2-s2.0-85044295102&partnerID=40&md5=569b00c185866123ee5a38d8db10ee4c,Conference Review,Final
EC5,On the Performance and Cost of Cloud-Assisted Multi-path Bulk Data Transfer,2017,"Proceedings of the International Conference on Cloud Computing Technology and Science, CloudCom","Jeong, K., Figueiredo, R., Ichikawa, K.",2017-December,,10.1109/CloudCom.2017.27,https://www.scopus.com/inward/record.uri?eid=2-s2.0-85044253674&doi=10.1109%2fCloudCom.2017.27&partnerID=40&md5=22e968c424794a798daf8a15be49ecb7,Conference Paper,Final
EC2,A scalable metaheuristic for service function chain composition,2017,"2017 IEEE 9th Latin-American Conference on Communications, LATINCOM 2017","Gil-Herrera, J., Botero, J.F.",2017-January,,10.1109/LATINCOM.2017.8240194,https://www.scopus.com/inward/record.uri?eid=2-s2.0-85046470114&doi=10.1109%2fLATINCOM.2017.8240194&partnerID=40&md5=f11c06a11be9b96ce967da4a8e2253cb,Conference Paper,Final
EC2,Performance guarantee aware orchestration for service function chains with elastic demands,2017,"2017 IEEE Conference on Network Function Virtualization and Software Defined Networks, NFV-SDN 2017","Wen, T., Yu, H., Du, X.",2017-January,,10.1109/NFV-SDN.2017.8169854,https://www.scopus.com/inward/record.uri?eid=2-s2.0-85043271744&doi=10.1109%2fNFV-SDN.2017.8169854&partnerID=40&md5=19ea7c2f7b90a208e0350fc7cd13b644,Conference Paper,Final
EC4,An intelligent honeynet architecture based on software defined security,2017,"2017 9th International Conference on Wireless Communications and Signal Processing, WCSP 2017 - Proceedings","Meng, X., Zhao, Z., Li, R., Zhang, H.",2017-January,,10.1109/WCSP.2017.8171066,https://www.scopus.com/inward/record.uri?eid=2-s2.0-85046425713&doi=10.1109%2fWCSP.2017.8171066&partnerID=40&md5=c9bc5a569138dc3fa6fde364a6209469,Conference Paper,Final
EC4,Enabling Fast Packet Processing for NFV via Programmable Hardware Acceleration,2017,Tien Tzu Hsueh Pao/Acta Electronica Sinica,"Lan, T.-Y., Guo, Y.-F., Lan, J.-L., Duan, T.",45,,10.3969/j.issn.0372-2112.2017.12.034,https://www.scopus.com/inward/record.uri?eid=2-s2.0-85046155641&doi=10.3969%2fj.issn.0372-2112.2017.12.034&partnerID=40&md5=4237c2def31677fb2ed62560d1c12ce4,Article,Final
EC2,Construction and Resource Allocation of Cost-Efficient Clustered Virtual Network in Software Defined Networks,2017,Journal of Grid Computing,"Li, B., Guo, S., Wu, Y., Liu, D.",15,,10.1007/s10723-017-9402-6,https://www.scopus.com/inward/record.uri?eid=2-s2.0-85020297714&doi=10.1007%2fs10723-017-9402-6&partnerID=40&md5=77363107cc5abc33c69529c7fc96e3de,Article,Final
EC2,Wireless virtual network embedding algorithm through topology awareness,2017,ICOCN 2017 - 16th International Conference on Optical Communications and Networks,"Zhu, L., Zhang, Z.Z., Feng, L.L.",2017-January,,10.1109/ICOCN.2017.8121506,https://www.scopus.com/inward/record.uri?eid=2-s2.0-85043605989&doi=10.1109%2fICOCN.2017.8121506&partnerID=40&md5=277e0692c5e0e3fe99cbaae6743aaa11,Conference Paper,Final
EC2,Joint IT and spectrum resource load balancing for VNF selection in inter-datacenter elastic optical networks,2017,ICOCN 2017 - 16th International Conference on Optical Communications and Networks,"Li, B., Yu, X., Zhao, Y., Li, Y., Ou, Q., Liu, Z., Liao, X., Zhang, J.",2017-January,,10.1109/ICOCN.2017.8121480,https://www.scopus.com/inward/record.uri?eid=2-s2.0-85043690769&doi=10.1109%2fICOCN.2017.8121480&partnerID=40&md5=759a5e5c2607ff6e55a8f7e53663d19e,Conference Paper,Final
EC4,Virtual network migration on the GENI wide-area SDN-enabled infrastructure,2017,"2017 IEEE Conference on Computer Communications Workshops, INFOCOM WKSHPS 2017","Zhao, Y., Lo, S., Zegura, E., Ammar, M., Riga, N.",,8116387,10.1109/INFCOMW.2017.8116387,https://www.scopus.com/inward/record.uri?eid=2-s2.0-85041371717&doi=10.1109%2fINFCOMW.2017.8116387&partnerID=40&md5=0b42b2e4993321c244a65bc73b05594d,Conference Paper,Final
EC2,ETOM mapping onto NFV framework: IMS use case,2017,ACM International Conference Proceeding Series,"Seraoui, Y., Belmekki, M., Bellafkih, M., Raouyane, B.",,a45,10.1145/3167486.3167534,https://www.scopus.com/inward/record.uri?eid=2-s2.0-85049659980&doi=10.1145%2f3167486.3167534&partnerID=40&md5=0686d6209a5c56575d701e2163bcdb3c,Conference Paper,Final
EC4,Network function virtualization: A survey,2017,IEICE Transactions on Communications,"Veeraraghavan, M., Sato, T., Buchanan, M., Rahimi, R., Okamoto, S., Yamanaka, N.",E100B,,10.1587/transcom.2016NNI0001,https://www.scopus.com/inward/record.uri?eid=2-s2.0-85033552506&doi=10.1587%2ftranscom.2016NNI0001&partnerID=40&md5=d6839d6ff8ffc55d2786180a9c0fd47d,Review,Final
EC2,Location-Aware dynamic network provisioning,2017,"19th Asia-Pacific Network Operations and Management Symposium: Managing a World of Things, APNOMS 2017","Nguyen, V.-Q., Nguyen, S.-N., Choi, D., Kim, K.",,8094142,10.1109/APNOMS.2017.8094142,https://www.scopus.com/inward/record.uri?eid=2-s2.0-85040577066&doi=10.1109%2fAPNOMS.2017.8094142&partnerID=40&md5=2c3f86f58fb51195eddc3fc7f8633782,Conference Paper,Final
EC4,Dynamic Virtual Resource Allocation in Virtualized multi-RAT Cellular Networks,2017,Wireless Personal Communications,"Rakovic, V., Ichkov, A., Marinova, S., Todorovski, D., Atanasovski, V., Gavrilovska, L.",97,,10.1007/s11277-017-4568-6,https://www.scopus.com/inward/record.uri?eid=2-s2.0-85020446717&doi=10.1007%2fs11277-017-4568-6&partnerID=40&md5=8c4559d0b4d22570d213a2208003e897,Article,Final
EC4,Optimising microservice-based reliable NFV management &amp; orchestration architectures,2017,"Proceedings of 2017 9th International Workshop on Resilient Networks Design and Modeling, RNDM 2017","Soenen, T., Tavernier, W., Colle, D., Pickavet, M.",,8093034,10.1109/RNDM.2017.8093034,https://www.scopus.com/inward/record.uri?eid=2-s2.0-85040523237&doi=10.1109%2fRNDM.2017.8093034&partnerID=40&md5=186130b49eafd38e8e13810f8fb84829,Conference Paper,Final
EC6,"Proceedings of the 2017 IEEE 6th International Conference on Cloud Networking, CloudNet 2017",2017,"Proceedings of the 2017 IEEE 6th International Conference on Cloud Networking, CloudNet 2017",[No author name available],,,,https://www.scopus.com/inward/record.uri?eid=2-s2.0-85039938716&partnerID=40&md5=f4519d56203e838653dbb89299cb792e,Conference Review,Final
EC2,Energy-Efficient dynamic virtual network traffic engineering for north-south traffic in multi-location data center networks,2017,Computer Networks,"Maswood, M.M.S., Develder, C., Madeira, E., Medhi, D.",125,,10.1016/j.comnet.2017.04.042,https://www.scopus.com/inward/record.uri?eid=2-s2.0-85018670063&doi=10.1016%2fj.comnet.2017.04.042&partnerID=40&md5=2c782c50cb541078c5c34047e606acb0,Article,Final
EC2,Approximation algorithms for the NFV service distribution problem,2017,Proceedings - IEEE INFOCOM,"Feng, H., Llorca, J., Tulino, A.M., Raz, D., Molisch, A.F.",,8057039,10.1109/INFOCOM.2017.8057039,https://www.scopus.com/inward/record.uri?eid=2-s2.0-85034028730&doi=10.1109%2fINFOCOM.2017.8057039&partnerID=40&md5=3be447e057c1bd2881a074583a2352cb,Conference Paper,Final
