,Title,Year,Source title,Authors,Volume,Art. No.,DOI,Link,Document Type,Publication Stage
EC2,KeySFC: Traffic steering using strict source routing for dynamic and efficient network orchestration,2020,Computer Networks,"Dominicini, C.K., Vassoler, G.L., Valentim, R., Villaca, R.S., Ribeiro, M.R.N., Martinello, M., Zambon, E.",167,106975,10.1016/j.comnet.2019.106975,https://www.scopus.com/inward/record.uri?eid=2-s2.0-85075463519&doi=10.1016%2fj.comnet.2019.106975&partnerID=40&md5=0105e73b3a5d30dfc5a03a87df16a04f,Article,Final
EC5,Dynamic programming of network slices in software-defined metro-core optical networks,2020,Optical Switching and Networking,"Troia, S., Cibari, A., Alvizu, R., Maier, G.",36,100551,10.1016/j.osn.2019.100551,https://www.scopus.com/inward/record.uri?eid=2-s2.0-85076500086&doi=10.1016%2fj.osn.2019.100551&partnerID=40&md5=8fd5edf4e2d68ca8534bf55a3222e21f,Article,Final
EC5,Network slicing - enabled RAN management for 5G: Cross layer control based on SDN and SDR,2020,Computer Networks,"Barmpounakis, S., Maroulis, N., Papadakis, M., Tsiatsios, G., Soukaras, D., Alonistioti, N.",166,106987,10.1016/j.comnet.2019.106987,https://www.scopus.com/inward/record.uri?eid=2-s2.0-85074891345&doi=10.1016%2fj.comnet.2019.106987&partnerID=40&md5=fa49d4a6315075f0785f2fd492c3307e,Article,Final
EC2,An RBF neural network–based dynamic virtual network embedding algorithm,2019,Concurrency Computation,"Zheng, X., Zhang, Y., Zhang, H., Xue, Q.",31,e4516,10.1002/cpe.4516,https://www.scopus.com/inward/record.uri?eid=2-s2.0-85074875348&doi=10.1002%2fcpe.4516&partnerID=40&md5=152e66ea6498939240524245528ccd29,Conference Paper,Final
EC4,Impact of the maximum number of switching reconfigurations on the cost saving in network function virtualization environments with elastic optical interconnection,2019,Applied Sciences (Switzerland),"Eramo, V., Lavacca, F.G., Catena, T.",9,5167,10.3390/app9235167,https://www.scopus.com/inward/record.uri?eid=2-s2.0-85076087963&doi=10.3390%2fapp9235167&partnerID=40&md5=b2b06fd274da4c0efc63c106acb2bad2,Article,Final
OK,Profile-Based Resource Allocation for Virtualized Network Functions,2019,IEEE Transactions on Network and Service Management,"Van Rossem, S., Tavernier, W., Colle, D., Pickavet, M., Demeester, P.",16,8848599,10.1109/TNSM.2019.2943779,https://www.scopus.com/inward/record.uri?eid=2-s2.0-85076675542&doi=10.1109%2fTNSM.2019.2943779&partnerID=40&md5=440affd33a22845aab18efbe3eba92ae,Article,Final
EC2,Load-balancing and QoS based dynamic resource allocation method for smart gird fiber-wireless networks*,2019,Chinese Journal of Electronics,"Xu, S., Li, P., Qi, F., Guo, S., Zhou, G., Deng, W., Li, Y.",28,,10.1049/cje.2019.08.007,https://www.scopus.com/inward/record.uri?eid=2-s2.0-85075666799&doi=10.1049%2fcje.2019.08.007&partnerID=40&md5=c0672e7d2915b9d0ace1f6fa6aa4c876,Article,Final
OK,Data Driven Resource Allocation for NFV-Based Internet of Things,2019,IEEE Internet of Things Journal,"Tian, X., Huang, W., Yu, Z., Wang, X.",6,8717613,10.1109/JIOT.2019.2916865,https://www.scopus.com/inward/record.uri?eid=2-s2.0-85073459727&doi=10.1109%2fJIOT.2019.2916865&partnerID=40&md5=9c6040d10fb643a92f775a9a0980ca4f,Article,Final
EC2,Online Elastic Orchestration Policy of Service Function Chain Based on Flow Evolution Perception ,2019,Tien Tzu Hsueh Pao/Acta Electronica Sinica,"Gu, Y.-J., Hu, Y.-X., Ding, Y.-H., Xie, J.-C.",47,,10.3969/j.issn.0372-2112.2019.10.022,https://www.scopus.com/inward/record.uri?eid=2-s2.0-85076496778&doi=10.3969%2fj.issn.0372-2112.2019.10.022&partnerID=40&md5=57967a4b7621f5f7a38e9cee1e871878,Article,Final
OK,Virtual Network Function Dynamic Deployment Algorithm Based on Prediction for 5G Network Slicing,2019,Dianzi Yu Xinxi Xuebao/Journal of Electronics and Information Technology,"Tang, L., Zhou, Y., Yang, Y., Zhao, G., Chen, Q.",41,,10.11999/JEIT180894,https://www.scopus.com/inward/record.uri?eid=2-s2.0-85075661258&doi=10.11999%2fJEIT180894&partnerID=40&md5=fb2c821d1e03f8103da3306c420c8586,Article,Final
EC2,Application Topology-Aware Virtual Network Mapping and Service Provisioning in Programmable Networks,2019,"IEEE International Conference on Emerging Technologies and Factory Automation, ETFA","Ansah, F., Olaya, S.S.P., De Meer, H., Wollschlaeger, M.",2019-September,8869434,10.1109/ETFA.2019.8869434,https://www.scopus.com/inward/record.uri?eid=2-s2.0-85074195087&doi=10.1109%2fETFA.2019.8869434&partnerID=40&md5=5d2030f2a90af055146c3b31eaae7525,Conference Paper,Final
EC5,Write Variation Aware Buffer Assignment for Improved Lifetime of Non-Volatile Buffers in On-Chip Interconnects,2019,IEEE Transactions on Very Large Scale Integration (VLSI) Systems,"Rani, K., Kapoor, H.K.",27,8764609,10.1109/TVLSI.2019.2922471,https://www.scopus.com/inward/record.uri?eid=2-s2.0-85071542853&doi=10.1109%2fTVLSI.2019.2922471&partnerID=40&md5=297868e939bf39e75ea37f36ba71903b,Article,Final
OK,Dynamic Auto-scaling of VNFs based on Task Execution Patterns,2019,"2019 20th Asia-Pacific Network Operations and Management Symposium: Management in a Cyber-Physical World, APNOMS 2019","Mehmood, A., Khan, T.A., Diaz Rivera, J.J., Song, W.-C.",,8892836,10.23919/APNOMS.2019.8892836,https://www.scopus.com/inward/record.uri?eid=2-s2.0-85075299224&doi=10.23919%2fAPNOMS.2019.8892836&partnerID=40&md5=ffd6d07cb524e16b382ae71d835738ac,Conference Paper,Final
EC6,"2019 20th Asia-Pacific Network Operations and Management Symposium: Management in a Cyber-Physical World, APNOMS 2019",2019,"2019 20th Asia-Pacific Network Operations and Management Symposium: Management in a Cyber-Physical World, APNOMS 2019",[No author name available],,,,https://www.scopus.com/inward/record.uri?eid=2-s2.0-85075309880&partnerID=40&md5=03fe9813d9c450429c86d07729ca3a92,Conference Review,Final
EC2,Mapping strategy for virtual networks in one stage,2019,IET Communications,"Cao, H., Wu, S., Guo, Y., Zhu, H., Yang, L.",13,,10.1049/iet-com.2018.6175,https://www.scopus.com/inward/record.uri?eid=2-s2.0-85071002453&doi=10.1049%2fiet-com.2018.6175&partnerID=40&md5=5a72d7802512880ba610015ebd6648e4,Article,Final
EC2,SAFE: Service availability via failure elimination through VNF scaling,2019,ACM International Conference Proceeding Series,"Xia, R., Dai, H., Zheng, J., Gu, R., Wang, X., Chen, G.",,a54,10.1145/3337821.3337832,https://www.scopus.com/inward/record.uri?eid=2-s2.0-85071094553&doi=10.1145%2f3337821.3337832&partnerID=40&md5=537b7f716c8bd6fc565baa66333196fc,Conference Paper,Final
EC2,HDSO: A high-performance dynamic service orchestration algorithm in hybrid NFV networks,2019,"Proceedings - 21st IEEE International Conference on High Performance Computing and Communications, 17th IEEE International Conference on Smart City and 5th IEEE International Conference on Data Science and Systems, HPCC/SmartCity/DSS 2019","Liang, X., Chen, H.",,8855421,10.1109/HPCC/SmartCity/DSS.2019.00115,https://www.scopus.com/inward/record.uri?eid=2-s2.0-85073545588&doi=10.1109%2fHPCC%2fSmartCity%2fDSS.2019.00115&partnerID=40&md5=aed5ba08ff66eaf851ad705a10aecb5f,Conference Paper,Final
EC4,Efficient Network Sharing with Asymmetric Constraint Information,2019,IEEE Journal on Selected Areas in Communications,"Zhang, M., Huang, J.",37,8756278,10.1109/JSAC.2019.2927136,https://www.scopus.com/inward/record.uri?eid=2-s2.0-85068544385&doi=10.1109%2fJSAC.2019.2927136&partnerID=40&md5=b0fba081628f74e72aba9afff1117207,Article,Final
EC4,Industrial-scale stateless network functions,2019,"IEEE International Conference on Cloud Computing, CLOUD","Szalay, M., Nagy, M., Gehberger, D., Kiss, Z., Matray, P., Nemeth, F., Pongracz, G., Retvari, G., Toka, L.",2019-July,8814530,10.1109/CLOUD.2019.00068,https://www.scopus.com/inward/record.uri?eid=2-s2.0-85072327380&doi=10.1109%2fCLOUD.2019.00068&partnerID=40&md5=24383a36df18f6023f63611042d189d3,Conference Paper,Final
EC5,Multi-virtual wireless mesh networks through multiple channels and interfaces,2019,Wireless Networks,"Marques, C., Kandasamy, S., Sargento, S., Matos, R., Calçada, T., Ricardo, M.",25,,10.1007/s11276-017-1650-7,https://www.scopus.com/inward/record.uri?eid=2-s2.0-85039978419&doi=10.1007%2fs11276-017-1650-7&partnerID=40&md5=164f421d3406d3f69618c2d8b005b6df,Article,Final
OK,Online NFV-Enabled multicasting in mobile edge cloud networks,2019,Proceedings - International Conference on Distributed Computing Systems,"Ma, Y., Liang, W., Wu, J.",2019-July,8885298,10.1109/ICDCS.2019.00086,https://www.scopus.com/inward/record.uri?eid=2-s2.0-85074855109&doi=10.1109%2fICDCS.2019.00086&partnerID=40&md5=c816972e9f7851416b004596f8682739,Conference Paper,Final
OK,Machine learning-based method for prediction of virtual network function resource demands,2019,"Proceedings of the 2019 IEEE Conference on Network Softwarization: Unleashing the Power of Network Softwarization, NetSoft 2019","Kim, H.-G., Lee, D.-Y., Jeong, S.-Y., Choi, H., Yoo, J.-H., Hong, J.W.-K.",,8806687,10.1109/NETSOFT.2019.8806687,https://www.scopus.com/inward/record.uri?eid=2-s2.0-85072019564&doi=10.1109%2fNETSOFT.2019.8806687&partnerID=40&md5=08314e1b07f6678ee2548efd16bb6506,Conference Paper,Final
OK,Latency-aware Virtualized Network Function provisioning for distributed edge clouds,2019,Journal of Systems and Software,"Son, J., Buyya, R.",152,,10.1016/j.jss.2019.02.030,https://www.scopus.com/inward/record.uri?eid=2-s2.0-85062071319&doi=10.1016%2fj.jss.2019.02.030&partnerID=40&md5=fb8d16e47bbe1b8299f5704c1e3c640f,Article,Final
OK,ElasticSFC: Auto-scaling techniques for elastic service function chaining in network functions virtualization-based clouds,2019,Journal of Systems and Software,"Nadjaran Toosi, A., Son, J., Chi, Q., Buyya, R.",152,,10.1016/j.jss.2019.02.052,https://www.scopus.com/inward/record.uri?eid=2-s2.0-85062466163&doi=10.1016%2fj.jss.2019.02.052&partnerID=40&md5=b500c1d4055a59e41cefb8c3ca6bd8be,Review,Final
EC2,Machine Learning-assisted Planning and Provisioning for SDN/NFV-enabled Metropolitan Networks,2019,"2019 European Conference on Networks and Communications, EuCNC 2019","Troia, S., Martinez, D.E., Martin, I., Zorello, L.M.M., Maier, G., Hernandez, J.A., Gonzalez De Dios, O., Garrich, M., Romero-Gazquez, J.L., Moreno-Muro, F.-J., Marino, P.P., Casellas, R.",,8801956,10.1109/EuCNC.2019.8801956,https://www.scopus.com/inward/record.uri?eid=2-s2.0-85071733445&doi=10.1109%2fEuCNC.2019.8801956&partnerID=40&md5=f355c44c901c38eb285975a380ecfd48,Conference Paper,Final
EC3,Reconfiguration in network slicing-optimizing the profit and performance,2019,IEEE Transactions on Network and Service Management,"Wang, G., Feng, G., Quek, T.Q.S., Qin, S., Wen, R., Tan, W.",16,8642931,10.1109/TNSM.2019.2899609,https://www.scopus.com/inward/record.uri?eid=2-s2.0-85071036099&doi=10.1109%2fTNSM.2019.2899609&partnerID=40&md5=771514d0805c107170ff8c98e182a43c,Article,Final
EC4,Reinforcement learning based resource management for network slicing,2019,Applied Sciences (Switzerland),"Kim, Y., Kim, S., Lim, H.",9,2361,10.3390/app9112361,https://www.scopus.com/inward/record.uri?eid=2-s2.0-85067250873&doi=10.3390%2fapp9112361&partnerID=40&md5=741642ed3721e7aa5085553ee202d36b,Article,Final
EC6,Dynamic accelerator provisioning for SSH tunnels in NFV environments,2019,"Proceedings of the 2019 IEEE Conference on Network Softwarization: Unleashing the Power of Network Softwarization, NetSoft 2019","Sharma, G.P., Tavernier, W., Colle, D., Pickavet, M.",,8806690,10.1109/NETSOFT.2019.8806690,https://www.scopus.com/inward/record.uri?eid=2-s2.0-85072048678&doi=10.1109%2fNETSOFT.2019.8806690&partnerID=40&md5=adcda0f1a74b40c75d8ee8f5bc6c6a5e,Conference Paper,Final
EC3,Joint balancing of IT and spectrum resources for selecting virtualized network function in inter-datacenter elastic optical networks,2019,Optics Express,"Li, Y., Zhao, Y., Li, B., Yu, X., Yang, H., Wang, X., Zhang, J.",27,,10.1364/OE.27.015116,https://www.scopus.com/inward/record.uri?eid=2-s2.0-85066320982&doi=10.1364%2fOE.27.015116&partnerID=40&md5=d180f92b99acdadda72e8ac1a56babcf,Article,Final
EC5,Optimal distributed resource allocation in 5G virtualized networks,2019,"2019 IFIP/IEEE Symposium on Integrated Network and Service Management, IM 2019","Halabian, H.",,8717789,,https://www.scopus.com/inward/record.uri?eid=2-s2.0-85066994173&partnerID=40&md5=427a1d483e90818304a889309190709f,Conference Paper,Final
EC5,Towards virtualization of software-defined networks: A journey in three acts,2019,"2019 IFIP/IEEE Symposium on Integrated Network and Service Management, IM 2019","Blenk, A., Kellerer, W.",,8717861,,https://www.scopus.com/inward/record.uri?eid=2-s2.0-85067001784&partnerID=40&md5=84db063c9157505a0d819c6c9df5d6a6,Conference Paper,Final
EC6,"2019 IFIP/IEEE Symposium on Integrated Network and Service Management, IM 2019",2019,"2019 IFIP/IEEE Symposium on Integrated Network and Service Management, IM 2019",[No author name available],,,,https://www.scopus.com/inward/record.uri?eid=2-s2.0-85067021842&partnerID=40&md5=d46bf218111721bfcdac8b53a94a5ebd,Conference Review,Final
OK,On the scaling of virtualized network functions,2019,"2019 IFIP/IEEE Symposium on Integrated Network and Service Management, IM 2019","Rankothge, W., Ramalhinho, H., Lobo, J.",,8717828,,https://www.scopus.com/inward/record.uri?eid=2-s2.0-85066974490&partnerID=40&md5=0997d3a11353ab506b8b68bae8f34763,Conference Paper,Final
EC2,Dynamic embedding and scheduling of virtual network service for future networks,2019,"2019 IEEE International Conference on Communications Workshops, ICC Workshops 2019 - Proceedings","Cao, H., Zhang, Y., Yang, L.",,8756912,10.1109/ICCW.2019.8756912,https://www.scopus.com/inward/record.uri?eid=2-s2.0-85065311102&doi=10.1109%2fICCW.2019.8756912&partnerID=40&md5=ad00e020bab4365bf74b773678fe5364,Conference Paper,Final
EC2,Accommodating Dynamic Traffic Immediately: A VNF Placement Approach,2019,IEEE International Conference on Communications,"Zhou, W., Yang, Y., Xu, M., Chen, H.",2019-May,8761554,10.1109/ICC.2019.8761554,https://www.scopus.com/inward/record.uri?eid=2-s2.0-85070214033&doi=10.1109%2fICC.2019.8761554&partnerID=40&md5=3a580bd7ebef2304d14abfe676f5a29e,Conference Paper,Final
EC2,Latency-Aware Traffic Grooming for Dynamic Service Chaining in Metro Networks,2019,IEEE International Conference on Communications,"Askari, L., Musumeci, F., Tornatore, M.",2019-May,8761290,10.1109/ICC.2019.8761290,https://www.scopus.com/inward/record.uri?eid=2-s2.0-85070236133&doi=10.1109%2fICC.2019.8761290&partnerID=40&md5=5b472fee058bce3838090f2c68b603f1,Conference Paper,Final
EC4,Resource Allocation Optimization in the NFV-Enabled MEC Network Based on Game Theory,2019,IEEE International Conference on Communications,"Wu, B., Zeng, J., Ge, L., Shao, S., Tang, Y., Su, X.",2019-May,8761912,10.1109/ICC.2019.8761912,https://www.scopus.com/inward/record.uri?eid=2-s2.0-85070226939&doi=10.1109%2fICC.2019.8761912&partnerID=40&md5=32d1c031b129de3357f455aa5a858cb6,Conference Paper,Final
EC6,"2019 IEEE 20th International Conference on High Performance Switching and Routing, HPSR 2019",2019,"IEEE International Conference on High Performance Switching and Routing, HPSR",[No author name available],2019-May,,,https://www.scopus.com/inward/record.uri?eid=2-s2.0-85071934139&partnerID=40&md5=6dc0604f8159e824e7d2ca08fa4833de,Conference Review,Final
EC2,Coordinated Resource Allocation with VNFs Precedence Constraints in Inter-Datacenter Networks over Elastic Optical Infrastructure,2019,"2018 IEEE World Symposium on Communication Engineering, WSCE 2018","Xu, Z., Jin, C., Yang, F., Ding, Z., Du, S., Zhao, G.",,8690540,10.1109/WSCE.2018.8690540,https://www.scopus.com/inward/record.uri?eid=2-s2.0-85065030814&doi=10.1109%2fWSCE.2018.8690540&partnerID=40&md5=1e58f3296c3e13eb7a8ab92f8c91f32e,Conference Paper,Final
EC5,An Autonomous Service-Oriented Orchestration Framework for Software Defined Mobile Networks,2019,"Proceedings of the 2019 22nd Conference on Innovation in Clouds, Internet and Networks and Workshops, ICIN 2019","Dang, X.-T., Khan, M.A., Sivrikaya, F.",,8685919,10.1109/ICIN.2019.8685919,https://www.scopus.com/inward/record.uri?eid=2-s2.0-85064993463&doi=10.1109%2fICIN.2019.8685919&partnerID=40&md5=7607dbd9dd95969115c4ecb7e78c2d13,Conference Paper,Final
OK,Base Station Popularity-Based Dynamic Resource Allocation for VNF,2019,"2019 2nd International Conference on Communication Engineering and Technology, ICCET 2019","Sun, S., Zhou, J., Sun, Y., Feng, G., Qin, S., She, W.",,8726889,10.1109/ICCET.2019.8726889,https://www.scopus.com/inward/record.uri?eid=2-s2.0-85067919086&doi=10.1109%2fICCET.2019.8726889&partnerID=40&md5=96a9073a976ea4a5884e969778131ba6,Conference Paper,Final
EC4,Adding Support for Automatic Enforcement of Security Policies in NFV Networks,2019,IEEE/ACM Transactions on Networking,"Basile, C., Valenza, F., Lioy, A., Lopez, D.R., Pastor Perales, A.",27,8637976,10.1109/TNET.2019.2895278,https://www.scopus.com/inward/record.uri?eid=2-s2.0-85061526400&doi=10.1109%2fTNET.2019.2895278&partnerID=40&md5=4a1be9ef40207245e42835e935a04480,Article,Final
EC2,Optimal Delay-Aware Service Function Chaining in NFV,2019,ICEE 2019 - 27th Iranian Conference on Electrical Engineering,"Yaghoubpour, F., Bakhshi, B.",,8786444,10.1109/IranianCEE.2019.8786444,https://www.scopus.com/inward/record.uri?eid=2-s2.0-85071028346&doi=10.1109%2fIranianCEE.2019.8786444&partnerID=40&md5=d85df7191b853b00f5a3ebdf29f5ab96,Conference Paper,Final
EC5,Moving the network to the cloud: The cloud central office revolution and its implications for the optical layer,2019,Journal of Lightwave Technology,"Ruffini, M., Slyne, F.",37,8606981,10.1109/JLT.2019.2891990,https://www.scopus.com/inward/record.uri?eid=2-s2.0-85064079415&doi=10.1109%2fJLT.2019.2891990&partnerID=40&md5=a29e10e29a18afc2e52024370d6b0106,Article,Final
EC6,Cooperative AI-based e2e Network Slice Scaling,2019,"INFOCOM 2019 - IEEE Conference on Computer Communications Workshops, INFOCOM WKSHPS 2019","Bouzid, M., Luong, D.H., Kostadinov, D., Jin, Y., Maggi, L., Outtagarts, A., Aghasaryan, A.",,8845198,10.1109/INFCOMW.2019.8845198,https://www.scopus.com/inward/record.uri?eid=2-s2.0-85073247150&doi=10.1109%2fINFCOMW.2019.8845198&partnerID=40&md5=3c3a1b56422ffe2697caff5ff9fd0740,Conference Paper,Final
EC2,Achieving a Fully-Flexible Virtual Network Embedding in Elastic Optical Networks,2019,Proceedings - IEEE INFOCOM,"Shahriar, N., Taeb, S., Chowdhury, S.R., Tornatore, M., Boutaba, R., Mitra, J., Hemmati, M.",2019-April,8737601,10.1109/INFOCOM.2019.8737601,https://www.scopus.com/inward/record.uri?eid=2-s2.0-85068235816&doi=10.1109%2fINFOCOM.2019.8737601&partnerID=40&md5=63130c64a247d19d6bb11f6c9106dbde,Conference Paper,Final
EC4,A Survey on the Placement of Virtual Resources and Virtual Network Functions,2019,IEEE Communications Surveys and Tutorials,"Laghrissi, A., Taleb, T.",21,8556457,10.1109/COMST.2018.2884835,https://www.scopus.com/inward/record.uri?eid=2-s2.0-85057774029&doi=10.1109%2fCOMST.2018.2884835&partnerID=40&md5=479fb9aa4635f71f62e5ee191888c342,Review,Final
EC6,"2019 2nd International Conference on Communication Engineering and Technology, ICCET 2019",2019,"2019 2nd International Conference on Communication Engineering and Technology, ICCET 2019",[No author name available],,,,https://www.scopus.com/inward/record.uri?eid=2-s2.0-85067955163&partnerID=40&md5=a080171d52178d55dc71d416e0b876be,Conference Review,Final
OK,NFV Closed-loop Automation Experiments using Deep Reinforcement Learning,2019,"INFOCOM 2019 - IEEE Conference on Computer Communications Workshops, INFOCOM WKSHPS 2019","Zhou, Z., Zhang, T., Kwatra, A.",,8845222,10.1109/INFCOMW.2019.8845222,https://www.scopus.com/inward/record.uri?eid=2-s2.0-85073195882&doi=10.1109%2fINFCOMW.2019.8845222&partnerID=40&md5=7db7adb245723ad1e588aa9e048880d4,Conference Paper,Final
EC2,Distributed Resource Allocation Optimization in 5G Virtualized Networks,2019,IEEE Journal on Selected Areas in Communications,"Halabian, H.",37,8635559,10.1109/JSAC.2019.2894305,https://www.scopus.com/inward/record.uri?eid=2-s2.0-85061626520&doi=10.1109%2fJSAC.2019.2894305&partnerID=40&md5=5f31a3ac1b1dcaa57af0814629d15907,Article,Final
EC2,Single and Multi-Domain Adaptive Allocation Algorithms for VNF Forwarding Graph Embedding,2019,IEEE Transactions on Network and Service Management,"Quang, P.T.A., Bradai, A., Singh, K.D., Picard, G., Riggio, R.",16,8494813,10.1109/TNSM.2018.2876623,https://www.scopus.com/inward/record.uri?eid=2-s2.0-85055017777&doi=10.1109%2fTNSM.2018.2876623&partnerID=40&md5=bdf57f5dcbe9e26b00d9838bba53f38e,Article,Final
EC4,Stochastic Performance Analysis of Network Function Virtualization in Future Internet,2019,IEEE Journal on Selected Areas in Communications,"Miao, W., Min, G., Wu, Y., Huang, H., Zhao, Z., Wang, H., Luo, C.",37,8624508,10.1109/JSAC.2019.2894304,https://www.scopus.com/inward/record.uri?eid=2-s2.0-85060479721&doi=10.1109%2fJSAC.2019.2894304&partnerID=40&md5=fba56c75d7fcb72421c8c2567d120f28,Article,Final
OK,Dynamic Network Function Instance Scaling Based on Traffic Forecasting and VNF Placement in Operator Data Centers,2019,IEEE Transactions on Parallel and Distributed Systems,"Tang, H., Zhou, D., Chen, D.",30,8449985,10.1109/TPDS.2018.2867587,https://www.scopus.com/inward/record.uri?eid=2-s2.0-85052639355&doi=10.1109%2fTPDS.2018.2867587&partnerID=40&md5=aa017d73d85f38ae32a04a724de94dad,Article,Final
EC2,On Incentive-Driven VNF Service Chaining in Inter-Datacenter Elastic Optical Networks: A Hierarchical Game-Theoretic Mechanism,2019,IEEE Transactions on Network and Service Management,"Chen, X., Zhu, Z., Proietti, R., Yoo, S.J.B.",16,8443142,10.1109/TNSM.2018.2866400,https://www.scopus.com/inward/record.uri?eid=2-s2.0-85052707007&doi=10.1109%2fTNSM.2018.2866400&partnerID=40&md5=e882643e9c0d09a34542a5ffbe083c86,Article,Final
EC2,Resource availability–aware adaptive provisioning of virtual data center networks,2019,International Journal of Network Management,"Gilesh, M.P., Madhu Kumar, S.D., Jacob, L.",29,e2066,10.1002/nem.2066,https://www.scopus.com/inward/record.uri?eid=2-s2.0-85061995424&doi=10.1002%2fnem.2066&partnerID=40&md5=7cba2900cd2c1b6dc74e64a894261b7a,Article,Final
EC2,Resource Allocation over EON-Based Infrastructures in a Network Virtualization Environment,2019,IEEE Transactions on Network and Service Management,"Soto, P., Maya, P., Botero, J.F.",16,8544032,10.1109/TNSM.2018.2883488,https://www.scopus.com/inward/record.uri?eid=2-s2.0-85057392233&doi=10.1109%2fTNSM.2018.2883488&partnerID=40&md5=a92347035a224d3d391521a0b58c175d,Article,Final
EC5,Efficiently allocating distributed caching resources in future smart networks,2019,"2019 16th IEEE Annual Consumer Communications and Networking Conference, CCNC 2019","Ben-Ammar, H., Hadjadj-Aoul, Y., Ait-Chellouche, S.",,8651854,10.1109/CCNC.2019.8651854,https://www.scopus.com/inward/record.uri?eid=2-s2.0-85063515112&doi=10.1109%2fCCNC.2019.8651854&partnerID=40&md5=1a1dd95d30d0f26ed10b8521e26b96a1,Conference Paper,Final
EC2,Trade-Offs in Dynamic Resource Allocation in Network Function Virtualization,2019,"2018 IEEE Globecom Workshops, GC Wkshps 2018 - Proceedings","Schneider, S., Draxler, S., Karl, H.",,8644352,10.1109/GLOCOMW.2018.8644352,https://www.scopus.com/inward/record.uri?eid=2-s2.0-85063527404&doi=10.1109%2fGLOCOMW.2018.8644352&partnerID=40&md5=d8615d6f3ff3c6d253acf93a3c65d385,Conference Paper,Final
OK,ENSC: Multi-Resource Hybrid Scaling for Elastic Network Service Chain in Clouds,2019,Proceedings of the International Conference on Parallel and Distributed Systems - ICPADS,"Yu, H., Yang, J., Fung, C., Boutaba, R., Zhuang, Y.",2018-December,8644630,10.1109/PADSW.2018.8644630,https://www.scopus.com/inward/record.uri?eid=2-s2.0-85063356531&doi=10.1109%2fPADSW.2018.8644630&partnerID=40&md5=be0afc8b1a591563f3d3375e59916167,Conference Paper,Final
EC4,A control and management architecture supporting autonomic NFV services,2019,Photonic Network Communications,"Velasco, L., Casellas, R., Llana, S., Gifre, L., Martínez, R., Vilalta, R., Muñoz, R., Ruiz, M.",37,,10.1007/s11107-018-0808-2,https://www.scopus.com/inward/record.uri?eid=2-s2.0-85056768488&doi=10.1007%2fs11107-018-0808-2&partnerID=40&md5=67b36ebd21309dd761bd854a934aeb75,Article,Final
EC4,Autonomic Network Management and cross-layer optimization in Software Defined radio environments,2019,Future Internet,"Stamou, A., Kakkavas, G., Tsitseklis, K., Karyotis, V., Papavassiliou, S.",11,37,10.3390/fi11020037,https://www.scopus.com/inward/record.uri?eid=2-s2.0-85061190116&doi=10.3390%2ffi11020037&partnerID=40&md5=458dca75a6acc2729e6c5b6043737655,Article,Final
EC2,A novel and one-stage embedding algorithm for mapping virtual networks,2019,"2018 24th Asia-Pacific Conference on Communications, APCC 2018","Cao, H., Chen, J., Guo, Y., Zhu, H., Yang, L.",,8633537,10.1109/APCC.2018.8633537,https://www.scopus.com/inward/record.uri?eid=2-s2.0-85062888655&doi=10.1109%2fAPCC.2018.8633537&partnerID=40&md5=312244e43fe9bee52770f7b36a3db313,Conference Paper,Final
EC2,Improving Cloud-Based IoT Services Through Virtual Network Embedding in Elastic Optical Inter-DC Networks,2019,IEEE Internet of Things Journal,"Wei, W., Gu, H., Wang, K., Yu, X., Liu, X.",6,8449303,10.1109/JIOT.2018.2866504,https://www.scopus.com/inward/record.uri?eid=2-s2.0-85052653319&doi=10.1109%2fJIOT.2018.2866504&partnerID=40&md5=b8e9cbc9ea1c8cb888774bcd550e8075,Article,Final
EC6,Demo: Automatic Deployment and Dynamic Scaling of NFV Service Chaining on Bare Metal (SCBM),2019,"IEEE Vehicular Networking Conference, VNC","Lai, W.-P., Chiu, K.-C.",2018-December,8628345,10.1109/VNC.2018.8628345,https://www.scopus.com/inward/record.uri?eid=2-s2.0-85062484232&doi=10.1109%2fVNC.2018.8628345&partnerID=40&md5=3bf94c595da4e4970e5885923cd83407,Conference Paper,Final
