,Title,Year,Source title,Authors,Volume,Art. No.,DOI,Link,Document Type,Publication Stage
EC4,Elastic and adaptive resource orchestration architecture on 3-tier network virtualization model,2016,IEICE Transactions on Information and Systems,"Shimamura, M., Yamanaka, H., Nagata, A., Iida, K., Kawai, E., Tsuru, M.",E99D,,10.1587/transinf.2014EDP7321,https://www.scopus.com/inward/record.uri?eid=2-s2.0-84962909917&doi=10.1587%2ftransinf.2014EDP7321&partnerID=40&md5=1e49d8373bcd338c9b36664a7e959040,Article,Final
EC2,Bandwidth guaranteed virtual network function placement and scaling in datacenter networks,2016,"2015 IEEE 34th International Performance Computing and Communications Conference, IPCCC 2015","Wang, F., Ling, R., Zhu, J., Li, D.",,7410276,10.1109/PCCC.2015.7410276,https://www.scopus.com/inward/record.uri?eid=2-s2.0-84970006556&doi=10.1109%2fPCCC.2015.7410276&partnerID=40&md5=616149336fe55271c7a70a2c67f878e5,Conference Paper,Final
EC2,A non-cooperative game-theoretic framework for resource allocation in network virtualization,2016,Telecommunication Systems,"Seddiki, M.S., Frikha, M., Song, Y.-Q.",61,,10.1007/s11235-015-9995-7,https://www.scopus.com/inward/record.uri?eid=2-s2.0-84955360217&doi=10.1007%2fs11235-015-9995-7&partnerID=40&md5=dcc7233a0ffa5a79b6876776835dec88,Article,Final
EC4,NFV use case - Delivering virtual CPE with multi-vendor VNF orchestration,2016,"2015 IEEE Conference on Network Function Virtualization and Software Defined Network, NFV-SDN 2015","Beereddy, S., Sirupa, K.",,7387399,10.1109/NFV-SDN.2015.7387399,https://www.scopus.com/inward/record.uri?eid=2-s2.0-84963599556&doi=10.1109%2fNFV-SDN.2015.7387399&partnerID=40&md5=7c1df7b10ecceb43ccac90eb2de55519,Conference Paper,Final
OK,Experimental results on the use of genetic algorithms for scaling virtualized network functions,2016,"2015 IEEE Conference on Network Function Virtualization and Software Defined Network, NFV-SDN 2015","Rankothge, W., Le, F., Russo, A., Lobo, J.",,7387405,10.1109/NFV-SDN.2015.7387405,https://www.scopus.com/inward/record.uri?eid=2-s2.0-84963502697&doi=10.1109%2fNFV-SDN.2015.7387405&partnerID=40&md5=9d978c36998808cb6851eb3bdae55231,Conference Paper,Final
EC5,"Satellite networking in the context of green, flexible and programmable networks",2016,"Lecture Notes of the Institute for Computer Sciences, Social-Informatics and Telecommunications Engineering, LNICST","Davoli, F.",148,,10.1007/978-3-319-47081-8_1,https://www.scopus.com/inward/record.uri?eid=2-s2.0-84996598130&doi=10.1007%2f978-3-319-47081-8_1&partnerID=40&md5=82dea9ad383b66a21d5a01e56417b64e,Conference Paper,Final
EC3,Dynamic cloud resource scheduling in virtualized 5G mobile systems,2016,"2016 IEEE Global Communications Conference, GLOBECOM 2016 - Proceedings","Bilal, A., Tarik, T., Vajda, A., Miloud, B.",,7841760,10.1109/GLOCOM.2016.7841760,https://www.scopus.com/inward/record.uri?eid=2-s2.0-85015387295&doi=10.1109%2fGLOCOM.2016.7841760&partnerID=40&md5=6c9cb82f9221b4e4954d9fea1a7d9bf3,Conference Paper,Final
EC2,Virtual network mapping algorithm based on load balancing,2016,International Journal of Grid and Distributed Computing,"Jiang, M., Tang, X., Zhang, M., Li, Z.",9,,10.14257/ijgdc.2016.9.9.35,https://www.scopus.com/inward/record.uri?eid=2-s2.0-85027030836&doi=10.14257%2fijgdc.2016.9.9.35&partnerID=40&md5=cd6a87399c6aa9b2a2b86d63ea5f6da3,Article,Final
EC5,Brokered Orchestration for End-to-End Service Provisioning across Heterogeneous Multi-Operator (Multi-AS) Optical Networks,2016,Journal of Lightwave Technology,"Castro, A., Velasco, L., Gifre, L., Chen, C., Yin, J., Zhu, Z., Proietti, R., Yoo, S.J.B.",PP,7571132,10.1109/JLT.2016.2610964,https://www.scopus.com/inward/record.uri?eid=2-s2.0-85027074989&doi=10.1109%2fJLT.2016.2610964&partnerID=40&md5=e6780ee1ebbfb0c8a98d42b07a6135ac,Article,Final
EC6,"6th International Conference on Cloud Computing, CloudComp 2015",2016,"Lecture Notes of the Institute for Computer Sciences, Social-Informatics and Telecommunications Engineering, LNICST",[No author name available],167,,,https://www.scopus.com/inward/record.uri?eid=2-s2.0-84969256034&partnerID=40&md5=90038965730bb93db17acb6737ed7106,Conference Review,Final
EC6,"Proceedings of the 11th International Conference on Network and Service Management, CNSM 2015",2015,"Proceedings of the 11th International Conference on Network and Service Management, CNSM 2015",[No author name available],,,,https://www.scopus.com/inward/record.uri?eid=2-s2.0-84964034033&partnerID=40&md5=f5af49fcabda0964612d18ea36477aba,Conference Review,Final
EC2,Elastic and efficient virtual network provisioning for cloud-based multi-tier applications,2015,Proceedings of the International Conference on Parallel Processing,"Shen, M., Xu, K., Li, F., Yang, K., Zhu, L., Guan, L.",2015-December,7349648,10.1109/ICPP.2015.102,https://www.scopus.com/inward/record.uri?eid=2-s2.0-84976464387&doi=10.1109%2fICPP.2015.102&partnerID=40&md5=17dee5ac578097931034702b4edeb0ad,Conference Paper,Final
OK,An adaptive resource provisioning scheme for effective qos maintenance in the IaaS Cloud,2015,"Proceedings of the 2015 International Workshop on Virtualization Technologies, VT 2015 - Held in conjunction with Middleware 2015","Adegboyega, A.",,2,10.1145/2835075.2835078,https://www.scopus.com/inward/record.uri?eid=2-s2.0-84964669936&doi=10.1145%2f2835075.2835078&partnerID=40&md5=46f87451af9b3bb1615b8c9a47f7ff43,Conference Paper,Final
EC4,A unified control and optimization framework for dynamical service chaining in software-defined NFV system,2015,IEEE Wireless Communications,"Li, Y., Zheng, F., Chen, M., Jin, D.",22,7368820,10.1109/MWC.2015.7368820,https://www.scopus.com/inward/record.uri?eid=2-s2.0-84971632072&doi=10.1109%2fMWC.2015.7368820&partnerID=40&md5=75decb87b38245780274ad931d3bcdd2,Article,Final
EC4,Performance evaluation of multi-stratum resources integration based on network function virtualization in software defined elastic data center optical interconnect,2015,Optics Express,"Yang, H., Zhang, J., Ji, Y., Tian, R., Han, J., Lee, Y.",23,,10.1364/OE.23.031192,https://www.scopus.com/inward/record.uri?eid=2-s2.0-84957599433&doi=10.1364%2fOE.23.031192&partnerID=40&md5=0d140db1243702ae1ff371c7b48e4b1d,Article,Final
EC6,"2015 International Conference on the Network of the Future, NOF 2015",2015,"2015 International Conference on the Network of the Future, NOF 2015",[No author name available],,,,https://www.scopus.com/inward/record.uri?eid=2-s2.0-84961876784&partnerID=40&md5=4e13d18fd2b68303c3ff9e17ae6c7100,Conference Review,Final
EC4,Service Differentiation in Software Defined Virtual Heterogeneous Wireless Networks,2015,"2015 IEEE International Conference on Ubiquitous Wireless Broadband, ICUWB 2015","Rahman, M.M., Despins, C., Affes, S.",,7324508,10.1109/ICUWB.2015.7324508,https://www.scopus.com/inward/record.uri?eid=2-s2.0-84962272133&doi=10.1109%2fICUWB.2015.7324508&partnerID=40&md5=2dc9977c9bfc0a3926236096d052048e,Conference Paper,Final
OK,A Dynamic Allocation Algorithm for Physical Carrier Resource in BBU Pool of Virtualized Wireless Network,2015,"Proceedings - 2015 International Conference on Cyber-Enabled Distributed Computing and Knowledge Discovery, CyberC 2015","Lu, G., Liu, C., Li, L., Yuan, Q.",,7307856,10.1109/CyberC.2015.23,https://www.scopus.com/inward/record.uri?eid=2-s2.0-84962547196&doi=10.1109%2fCyberC.2015.23&partnerID=40&md5=d2f3bc921f5e3d2c02468de7cc06cd12,Conference Paper,Final
EC5,Virtual resource allocation based on link interference in cayley wireless data centers,2015,IEEE Transactions on Computers,"Luo, J., Guo, Y., Fu, S., Li, K., He, W.",64,7005469,10.1109/TC.2015.2389798,https://www.scopus.com/inward/record.uri?eid=2-s2.0-84942455908&doi=10.1109%2fTC.2015.2389798&partnerID=40&md5=5671dd3c827583d32b1426f15a4b61ae,Article,Final
OK,SeReNe: On Establishing Secure and Resilient Networking Services for an SDN-based Multi-tenant Datacenter Environment,2015,"Proceedings - 2015 45th Annual IEEE/IFIP International Conference on Dependable Systems and Networks Workshops, DSN-W 2015","Chung, C.-J., Xing, T., Huang, D., Medhi, D., Trivedi, K.",,7272544,10.1109/DSN-W.2015.25,https://www.scopus.com/inward/record.uri?eid=2-s2.0-84957679321&doi=10.1109%2fDSN-W.2015.25&partnerID=40&md5=4efb5b4dabe3bca161bbe47f1a88003e,Conference Paper,Final
OK,MDP and Machine Learning-Based Cost-Optimization of Dynamic Resource Allocation for Network Function Virtualization,2015,"Proceedings - 2015 IEEE International Conference on Services Computing, SCC 2015","Shi, R., Zhang, J., Chu, W., Bao, Q., Jin, X., Gong, C., Zhu, Q., Yu, C., Rosenberg, S.",,7207337,10.1109/SCC.2015.19,https://www.scopus.com/inward/record.uri?eid=2-s2.0-84953385072&doi=10.1109%2fSCC.2015.19&partnerID=40&md5=42203c93c3e8b3a3dc5ed7f6e3bccb4d,Conference Paper,Final
EC6,MOBIMEDIA 2015 - 8th International Conference on Mobile Multimedia Communications,2015,MOBIMEDIA 2015 - 8th International Conference on Mobile Multimedia Communications,[No author name available],,,,https://www.scopus.com/inward/record.uri?eid=2-s2.0-85034977716&partnerID=40&md5=b4b5735c7bd35dc35f93456186b8db91,Conference Review,Final
EC3,Resource scheduling virtualization in service-oriented future Internet architecture,2015,Journal of China Universities of Posts and Telecommunications,"Lan, L., Jianya, C., Hongyan, C., Tao, H., Yunjie, L.",22,,10.1016/S1005-8885(15)60672-0,https://www.scopus.com/inward/record.uri?eid=2-s2.0-84961827121&doi=10.1016%2fS1005-8885%2815%2960672-0&partnerID=40&md5=b8dfe5ccbec3273482a0ef81c63bea46,Article,Final
EC4,Elastic network functions: Opportunities and challenges,2015,IEEE Network,"Szabó, R., Kind, M., Westphal, F.-J., Woesner, H., Jocha, D., Császar, A.",29,7113220,10.1109/MNET.2015.7113220,https://www.scopus.com/inward/record.uri?eid=2-s2.0-84930960350&doi=10.1109%2fMNET.2015.7113220&partnerID=40&md5=9f4e12db1eddaf6a32c3e5ac5e26b4d3,Article,Final
OK,A neuro-fuzzy approach to self-management of virtual network resources,2015,Expert Systems with Applications,"Mijumbi, R., Gorricho, J.-L., Serrat, J., Shen, M., Xu, K., Yang, K.",42,,10.1016/j.eswa.2014.08.058,https://www.scopus.com/inward/record.uri?eid=2-s2.0-84908447441&doi=10.1016%2fj.eswa.2014.08.058&partnerID=40&md5=4cf024be289f6747ebe674956f0c3f62,Article,Final
EC2,An elastic resource allocation algorithm enabling wireless network virtualization,2015,Wireless Communications and Mobile Computing,"Lu, X., Yang, K., Liu, Y., Zhou, D., Liu, S.",15,,10.1002/wcm.2342,https://www.scopus.com/inward/record.uri?eid=2-s2.0-84921859327&doi=10.1002%2fwcm.2342&partnerID=40&md5=fa5f7abc3c051dc8f68c2da0492188fe,Article,Final
EC2,Virtual network embedding in hybrid datacenters with dynamic wavelength grouping,2015,"Proceedings of the International Conference on Cloud Computing Technology and Science, CloudCom","Srinivas, R., Hegde, S., Divakaran, D.M., Gurusamy, M.",2015-February,7037782,10.1109/CloudCom.2014.34,https://www.scopus.com/inward/record.uri?eid=2-s2.0-84937878052&doi=10.1109%2fCloudCom.2014.34&partnerID=40&md5=4e3efe486c07e7e9b618ee91de1728d8,Conference Paper,Final
EC5,"Future Directions in Cable Networks, Services and Management",2015,"Cable Networks, Services, and Management","Toy, M.",,,10.1002/9781119000334.ch6,https://www.scopus.com/inward/record.uri?eid=2-s2.0-85015354862&doi=10.1002%2f9781119000334.ch6&partnerID=40&md5=38d67398546402f3073e79db702af201,Book Chapter,Final
EC3,"Open, elastic provisioning of hardware acceleration in NFV environments",2015,"Proceedings - International Conference on Networked Systems, NetSys 2015","Nobach, L., Hausheer, D.",,7089057,10.1109/NetSys.2015.7089057,https://www.scopus.com/inward/record.uri?eid=2-s2.0-84929380242&doi=10.1109%2fNetSys.2015.7089057&partnerID=40&md5=e7d70656f2af415206ee2fe536b2e758,Conference Paper,Final
EC4,Software-as-a-service for the virtualization of mobile network gateways,2015,"2015 IEEE Global Communications Conference, GLOBECOM 2015","Kiess, W., An, X., Beker, S.",,7416944,10.1109/GLOCOM.2014.7416944,https://www.scopus.com/inward/record.uri?eid=2-s2.0-84964857482&doi=10.1109%2fGLOCOM.2014.7416944&partnerID=40&md5=dfeab036f4cecb9e53f0a47e3722eaf1,Conference Paper,Final
EC4,Quality audit and resource brokering for network functions virtualization (NFV) orchestration in hybrid clouds,2015,"2015 IEEE Global Communications Conference, GLOBECOM 2015","Carella, G., Foschini, L., Pernafini, A., Bellavista, P., Corradi, A., Corici, M., Schreiner, F., Magedanz, T.",,7417385,10.1109/GLOCOM.2015.7417385,https://www.scopus.com/inward/record.uri?eid=2-s2.0-84981288009&doi=10.1109%2fGLOCOM.2015.7417385&partnerID=40&md5=1af4096742bbfc7530581136793c0502,Conference Paper,Final
OK,Efficient auto-scaling approach in the telco cloud using self-learning algorithm,2015,"2015 IEEE Global Communications Conference, GLOBECOM 2015","Tang, P., Li, F., Zhou, W., Hu, W., Yang, L.",,7417181,10.1109/GLOCOM.2014.7417181,https://www.scopus.com/inward/record.uri?eid=2-s2.0-84964849424&doi=10.1109%2fGLOCOM.2014.7417181&partnerID=40&md5=1bc6dbd26032e5afc0f044adcdf36607,Conference Paper,Final
EC6,"Proceedings of the 2015 IFIP/IEEE International Symposium on Integrated Network Management, IM 2015",2015,"Proceedings of the 2015 IFIP/IEEE International Symposium on Integrated Network Management, IM 2015",[No author name available],,,,https://www.scopus.com/inward/record.uri?eid=2-s2.0-84942693840&partnerID=40&md5=1a6de7278df1b0f83ca73b80b6fa86ba,Conference Review,Final
EC4,CPFirewall: A novel parallel firewall scheme for fwaas in the cloud environment,2015,Lecture Notes in Computer Science (including subseries Lecture Notes in Artificial Intelligence and Lecture Notes in Bioinformatics),"Wang, Z., Lu, Z., Wu, J., Fan, K.",9464,,10.1007/978-3-319-26979-5_9,https://www.scopus.com/inward/record.uri?eid=2-s2.0-84952065309&doi=10.1007%2f978-3-319-26979-5_9&partnerID=40&md5=61fc8e6b4be2fbbb98bc2fe27b6f1897,Conference Paper,Final
EC4,UNIFYing Cloud and carrier network resources: an architectural view,2015,"2015 IEEE Global Communications Conference, GLOBECOM 2015","Sonkoly, B., Szabo, R., Jocha, D., Czentye, J., Kind, M., Westphal, F.-J.",,7417869,10.1109/GLOCOM.2014.7417869,https://www.scopus.com/inward/record.uri?eid=2-s2.0-84964842371&doi=10.1109%2fGLOCOM.2014.7417869&partnerID=40&md5=974b65a56f3c7e9507d69cc99f76c7ef,Conference Paper,Final
EC2,A sub-graph mapping-based algorithm for virtual network allocation over flexible grid networks,2015,International Conference on Transparent Optical Networks,"Gonzalez, A., Barra, E., Beghelli, A., Leiva, A.",2015-August,7193484,10.1109/ICTON.2015.7193484,https://www.scopus.com/inward/record.uri?eid=2-s2.0-84940928988&doi=10.1109%2fICTON.2015.7193484&partnerID=40&md5=d2bfb2d3c47822ec5f3f71790feccf4d,Conference Paper,Final
EC2,Dynamic resource allocation in hybrid optical-electrical datacenter networks,2015,Computer Communications,"Divakaran, D.M., Hegde, S., Srinivas, R., Gurusamy, M.",69,,10.1016/j.comcom.2015.07.008,https://www.scopus.com/inward/record.uri?eid=2-s2.0-84944163158&doi=10.1016%2fj.comcom.2015.07.008&partnerID=40&md5=2ed502aeb526802a870ff61f676072c6,Article,Final
EC5,Software defined autonomic QoS model for future Internet,2015,Journal of Systems and Software,"Wang, W., Tian-, Y., Gong-, X., Qi-, Q., Hu, Y.",110,,10.1016/j.jss.2015.08.016,https://www.scopus.com/inward/record.uri?eid=2-s2.0-84944058348&doi=10.1016%2fj.jss.2015.08.016&partnerID=40&md5=840d5ea429f1f518713ae64e7a501168,Article,Final
EC2,Optimal virtual network embedding: Energy aware formulation,2015,Computer Networks,"Melo, M., Sargento, S., Killat, U., Timm-Giel, A., Carapinha, J.",91,,10.1016/j.comnet.2015.08.011,https://www.scopus.com/inward/record.uri?eid=2-s2.0-84955477873&doi=10.1016%2fj.comnet.2015.08.011&partnerID=40&md5=07154698debeb80945d60635ad797681,Article,Final
EC2,Energy efficient virtual network embedding for green data centers using data center topology and future migration,2015,Computer Communications,"Guan, X., Choi, B.-Y., Song, S.",69,,10.1016/j.comcom.2015.05.003,https://www.scopus.com/inward/record.uri?eid=2-s2.0-84944157703&doi=10.1016%2fj.comcom.2015.05.003&partnerID=40&md5=aa3a8a2e72fbecf08b0f8b9eb75f31e6,Article,Final
OK,Self-managed resources in network virtualisation environments,2015,"Proceedings of the 2015 IFIP/IEEE International Symposium on Integrated Network Management, IM 2015","Mijumbi, R., Serrat, J., Gorricho, J.-L.",,7140439,10.1109/INM.2015.7140439,https://www.scopus.com/inward/record.uri?eid=2-s2.0-84942636161&doi=10.1109%2fINM.2015.7140439&partnerID=40&md5=ad7195e3dc28866c202927d2ac523407,Conference Paper,Final
EC2,An evolved elastic resource virtualization algorithm for OFDMA-based wireless networks,2015,"Multimedia, Communication and Computing Application - Proceedings of the International Conference on Multimedia, Communication and Computing Application, MCCA 2014","Wei, J., Yang, K., Zhang, G., Hu, Z.",,,,https://www.scopus.com/inward/record.uri?eid=2-s2.0-84949845260&partnerID=40&md5=1df5facfa7803772f4f8a615d0c417d6,Conference Paper,Final
EC4,Towards making network function virtualization a cloud computing service,2015,"Proceedings of the 2015 IFIP/IEEE International Symposium on Integrated Network Management, IM 2015","Rankothge, W., Ma, J., Le, F., Russo, A., Lobo, J.",,7140280,10.1109/INM.2015.7140280,https://www.scopus.com/inward/record.uri?eid=2-s2.0-84942627021&doi=10.1109%2fINM.2015.7140280&partnerID=40&md5=6e6f39d300b0667fd53d45b995ac7385,Conference Paper,Final
EC4,Opportunistic spectrum sharing in software defined wireless network,2014,Journal of Systems Engineering and Electronics,"Yang, M., Li, Y., Jin, D., Su, L., Zeng, L.",25,,10.1109/JSEE.2014.00107,https://www.scopus.com/inward/record.uri?eid=2-s2.0-84930654095&doi=10.1109%2fJSEE.2014.00107&partnerID=40&md5=b0d98765248ef152019c7bad1d5c4781,Article,Final
EC2,Reliable design for stochastic multicast virtual network in data centres,2014,"IETE Technical Review (Institution of Electronics and Telecommunication Engineers, India)","Liao, D., Sun, G., Anand, V., Yu, H.",31,,10.1080/02564602.2014.957359,https://www.scopus.com/inward/record.uri?eid=2-s2.0-84981747034&doi=10.1080%2f02564602.2014.957359&partnerID=40&md5=43b8df1a350a5ca43e8e868a20860f9a,Article,Final
EC2,Concurrent resource mapping in virtual network,2014,Journal of Computational and Theoretical Nanoscience,"Luo, J., Fu, S., Chen, L., Li, R.",11,,10.1166/jctn.2014.3492,https://www.scopus.com/inward/record.uri?eid=2-s2.0-84896748933&doi=10.1166%2fjctn.2014.3492&partnerID=40&md5=3c019f9f7db9dae16e52f5b80545bd27,Article,Final
OK,Adaptive SLA-based elasticity management algorithms for a virtualized IP multimedia subsystem,2014,"2014 IEEE Globecom Workshops, GC Wkshps 2014","Nemati, H., Singhvi, A., Kara, N., El Barachi, M.",,7063377,10.1109/GLOCOMW.2014.7063377,https://www.scopus.com/inward/record.uri?eid=2-s2.0-84946686409&doi=10.1109%2fGLOCOMW.2014.7063377&partnerID=40&md5=e8e15ea32358459eda2e42cf81f6717e,Conference Paper,Final
EC4,Optimizing the topologies of virtual networks for cloud-based big data processing,2014,"Proceedings - 16th IEEE International Conference on High Performance Computing and Communications, HPCC 2014, 11th IEEE International Conference on Embedded Software and Systems, ICESS 2014 and 6th International Symposium on Cyberspace Safety and Security, CSS 2014","Xu, C., Yang, J., Yu, H., Lin, H., Zhang, H.",,7056739,10.1109/HPCC.2014.36,https://www.scopus.com/inward/record.uri?eid=2-s2.0-84949925956&doi=10.1109%2fHPCC.2014.36&partnerID=40&md5=26897c7b6bbf0ddff8bd2a7b805e7f6c,Conference Paper,Final
EC2,Network virtualization with dynamic resource pooling and trading mechanism,2014,"2014 IEEE Global Communications Conference, GLOBECOM 2014","Xie, W., Zhu, J., Huang, C., Luo, M., Chou, W.",,7037074,10.1109/GLOCOM.2014.7037074,https://www.scopus.com/inward/record.uri?eid=2-s2.0-84949922090&doi=10.1109%2fGLOCOM.2014.7037074&partnerID=40&md5=6bf4da1a6266288f46231d404c1609c3,Conference Paper,Final
EC2,Virtual network embedding and reconfiguration in elastic optical networks,2014,"2014 IEEE Global Communications Conference, GLOBECOM 2014","Shakya, S., Pradhan, N., Cao, X., Ye, Z., Qiao, C.",,7037128,10.1109/GLOCOM.2014.7037128,https://www.scopus.com/inward/record.uri?eid=2-s2.0-84949923398&doi=10.1109%2fGLOCOM.2014.7037128&partnerID=40&md5=de7f59284228054ceef0aa5002c0d18c,Conference Paper,Final
EC4,Survivability-oriented negotiation algorithms for multi-domain virtual networks,2014,"Proceedings of the 10th International Conference on Network and Service Management, CNSM 2014","Mijumbi, R., Gorricho, J.-L., Serrat, J., Rubio-Loyola, J., Aguero, R.",,7014173,10.1109/CNSM.2014.7014173,https://www.scopus.com/inward/record.uri?eid=2-s2.0-84922832149&doi=10.1109%2fCNSM.2014.7014173&partnerID=40&md5=157a2856f576a06b8f8d8b85902465e7,Conference Paper,Final
EC4,Network Security Function Virtualization(NSFV) towards Cloud computing with NFV over Openflow infrastructure: Challenges and novel approaches,2014,"Proceedings of the 2014 International Conference on Advances in Computing, Communications and Informatics, ICACCI 2014","Battula, L.R.",,6968453,10.1109/ICACCI.2014.6968453,https://www.scopus.com/inward/record.uri?eid=2-s2.0-84927661659&doi=10.1109%2fICACCI.2014.6968453&partnerID=40&md5=83eab845a83edcf33596d0e6124f3fa6,Conference Paper,Final
EC6,"2014 16th International Telecommunications Network Strategy and Planning Symposium, Networks 2014",2014,"2014 16th International Telecommunications Network Strategy and Planning Symposium, Networks 2014",[No author name available],,,,https://www.scopus.com/inward/record.uri?eid=2-s2.0-84919363711&partnerID=40&md5=b4118c83086faf165fb9c77b1a00fd87,Conference Review,Final
EC4,A PCE-based architecture for the management of virtualized infrastructures,2014,"2014 IEEE 3rd International Conference on Cloud Networking, CloudNet 2014","Donadio, P., Fioccola, G.B., Canonico, R., Ventre, G.",,6968996,10.1109/CloudNet.2014.6968996,https://www.scopus.com/inward/record.uri?eid=2-s2.0-84925855878&doi=10.1109%2fCloudNet.2014.6968996&partnerID=40&md5=0da0a422c92241519f08772fe7313293,Conference Paper,Final
EC6,"Proceedings of the 2014 10th International Conference on Heterogeneous Networking for Quality, Reliability, Security and Robustness, QSHINE 2014",2014,"Proceedings of the 2014 10th International Conference on Heterogeneous Networking for Quality, Reliability, Security and Robustness, QSHINE 2014",[No author name available],,,,https://www.scopus.com/inward/record.uri?eid=2-s2.0-84914128586&partnerID=40&md5=346d6dafdf8688dd0efe66fb3bf82407,Conference Review,Final
EC2,The dynamic placement of virtual network functions,2014,IEEE/IFIP NOMS 2014 - IEEE/IFIP Network Operations and Management Symposium: Management in a Software Defined World,"Clayman, S., Maini, E., Galis, A., Manzalini, A., Mazzocca, N.",,6838412,10.1109/NOMS.2014.6838412,https://www.scopus.com/inward/record.uri?eid=2-s2.0-84904185293&doi=10.1109%2fNOMS.2014.6838412&partnerID=40&md5=ae2ee9dc75c1d579f9b7afb4681d4058,Conference Paper,Final
EC6,"2014 IEEE 3rd International Conference on Cloud Networking, CloudNet 2014",2014,"2014 IEEE 3rd International Conference on Cloud Networking, CloudNet 2014",[No author name available],,,,https://www.scopus.com/inward/record.uri?eid=2-s2.0-84926059562&partnerID=40&md5=1250d0a2c9cdf9ff1a5821975dcd6756,Conference Review,Final
EC6,OpenANFV: Accelerating network function virtualization with a consolidated framework in OpenStack,2014,SIGCOMM 2014 - Proceedings of the 2014 ACM Conference on Special Interest Group on Data Communication,"Ge, X., Liu, Y., Du, D.H.C., Zhang, L., Guan, H., Chen, J., Zhao, Y., Hu, X.",,,10.1145/2619239.2631426,https://www.scopus.com/inward/record.uri?eid=2-s2.0-84907363736&doi=10.1145%2f2619239.2631426&partnerID=40&md5=b14234d883e8e2a7b7ba761b14f5aa08,Conference Paper,Final
EC6,Contributions to efficient resource management in virtual networks,2014,Lecture Notes in Computer Science (including subseries Lecture Notes in Artificial Intelligence and Lecture Notes in Bioinformatics),"Mijumbi, R., Gorricho, J.-L., Serrat, J.",8508 LNCS,,10.1007/978-3-662-43862-6_5,https://www.scopus.com/inward/record.uri?eid=2-s2.0-84904173687&doi=10.1007%2f978-3-662-43862-6_5&partnerID=40&md5=ac53613433a0a57029375a30fbb0a1ef,Conference Paper,Final
EC2,Commercial resource management model optimization under virtual network environment,2014,"Proceedings - 2014 6th International Conference on Measuring Technology and Mechatronics Automation, ICMTMA 2014","Wang, L.",,6802663,10.1109/ICMTMA.2014.47,https://www.scopus.com/inward/record.uri?eid=2-s2.0-84900458692&doi=10.1109%2fICMTMA.2014.47&partnerID=40&md5=912bcc2b6560aae735419c563f19177f,Conference Paper,Final
EC2,Topology and migration-aware energy efficient virtual network embedding for green data centers,2014,"Proceedings - International Conference on Computer Communications and Networks, ICCCN","Guan, X., Choi, B.-Y., Song, S.",,6911768,10.1109/ICCCN.2014.6911768,https://www.scopus.com/inward/record.uri?eid=2-s2.0-84908199202&doi=10.1109%2fICCCN.2014.6911768&partnerID=40&md5=5106db5d02528b3e99f035ffa9847af3,Conference Paper,Final
EC2,Efficient virtual network embedding via exploring periodic resource demands,2014,"Proceedings - Conference on Local Computer Networks, LCN","Xu, Z., Liang, W., Xia, Q.",,6925760,10.1109/LCN.2014.6925760,https://www.scopus.com/inward/record.uri?eid=2-s2.0-84908354354&doi=10.1109%2fLCN.2014.6925760&partnerID=40&md5=43abd63273ac6374f1375700d5813b22,Conference Paper,Final
